1	these spicy chips have a lot of great flavor but be warned , you will be left with some stanky breath afterwards ! the first time i ate these was at night and then even after brushing and flossing i could taste them in my mouth the next morning. so just be careful about when you eat them , especially if you will be hanging out with people later in the day.
1	these are not as good at houston &apos;s samba grill but they tasted great. the texture is different but in lieu of having these on a daily basis , i have found something that i can make. i would surely recommend these to anyonr.
0	this toy did not last. i have a boxer and he chewed the rope off the jar.
0	do not buy ! review online ! looks like another treat made in china with multiple reports of suspected poisoning ! ! ! please only buy treats made in the usa !
1	i love this tea which has a deep cinnamon aroma and taste. it &apos;s equally good as an iced tea. full marks !
0	this is not xapp recovery as is listed , it is xapp energy. the difference is that xapp energy contains caffeine.
0	i don &apos;t like strong coffee but this is so weak and watery , it &apos;s like drinking ... something other than coffee. i tried brewing a small size , using a different size cup , adjusting my cream and sugar , nothing works ! it &apos;s really disappointing because i &apos;ve had other good blends from green mountain in the past. i &apos;ll stick with wolfgang puck &apos;s rodeo drive or breakfast in bed.
1	i buy mostly for vending , so the size of the bag is important. kettle &apos;s 1 oz bag is a good size although it seems a bit less than full. salt &amp; vinegar flavor is satisfying , about an 8 out of 10.
0	fast shipping. smells good when you open the tea bag - tastes like watered down coffee with a faint mint aftertaste. not recommended.
1	my honey has a serious sweet tooth , which i accommodate by preparing him a weekly dessert. martha white &apos;s muffin mix is very convenient to prepare because it only requires one-half cup of milk , which i toss into my cuisinart ; and wah-la six beautiful muffins with virtually no prep time. they are moist , delicious , and economic.
0	i enjoyed these mints for many years ... they are now terrible because of the changes that wrigley has made to them. get rid of the color and put back the flavor. i will not buy them again unless they are changed back.
0	the company does not operate properly i ordered the french vanilla. that is the selection i clicked on and i recieved the white chocolate. they should contact a buyer before shipping a substitution.
1	not only are the truffles excellent , but the package arrived in record speed with standard shipping chosen. we are very pleased with our truffles and with our experience with this company. we will be ordering from them again !
0	i too was a little disappointed with the mix of the donut sampler. in my case i had 12 of the 35 were decaf. but i guess this is what you get when you purchase a sampler pack through the amazon warehouse deals section. all the k-cups had a best used by date of 6 / 2012. i was happy about that atleast.
0	and they definitely do , being as i tried out this whole 24 pack. they taste alright and not too much fat or calories but i dont know why but they give me gas ! ! at first i was confused but then i realised when i ate them is when id later stink up the room. never again !
1	my husband and i both really like the popchips. they are a great substitute for regular potato chips and we both find them very satisfying.
1	i ordered this for my daughter , who does not like coffee. she says it is the best tasting tea , and it brews perfectly with the keurig. also like the large quantity box.
0	i wanted something that had enough meat so my mini schnauzer would want to bite on it however i needed something that could entice him to chew on this rather than my apartment. this bone was not the solution. there is practically no meat on this bone and after two minutes of chewing he lost interest in it. i threw it away after the first week snce he never touched it again.
1	i love these chips. they are addictive ... it &apos;s hard to just eat a few. i tried the chili flavor that has great reviews and i don &apos;t think they compare to the salsa fresca. if you like a chip with a little kick ... these are perfect.
0	see &apos;s makes delicious chocolates ; close to the best ; but their chipping charges make each purchase a total rip off. i think that every one should boycott see &apos;s for that reason.
1	premium ghiradelli chocolate mixed with just a hit of coffee makes this a great drink. i &apos;ve gotten to where i add a heaping spoonful to my starbucks coffee every morning. it gives it an extra coffee flavor and the chocolate for ghiradelli far exceeds the &apos; mocha &apos; chocolate you get at most barista stands.
0	bought this after reading the good reviews - not sure if it has to do only with my package but rice and lentil mix literally has a smell of mold. i actually opened two containers to make sure it wasn &apos;t just my nose playing tricks on me. i love this brand and i am very disappointed.
1	love these cups ! i hated paying so much for my beloved keurig coffees , the cups work great , they are convenient , easy to use and i can use whatever coffee i choose ! ! ! ! !
0	if you are ordering cookies , beware , the &apos; cookies &apos; arrived in crumbles , so , if you want a box of stale crumbs order away : )
1	yuban has been my coffee of choice for 20 years. the price at amazon is very good. i recommend this product for any coffee lover.
1	chi-chi &apos;s sweet corn cake is awesome. the stores in our area stopped stocking this item. so happy to have found it on amazon.com. no other corn bread / cake mix comes close to being as good as this. it goes great with taco &apos;s , nacho &apos;s and chili. we also like to add in some frozen corn before we bake it. yum ! ! ! !
1	this is a terrific deal for a coffee lover that needs to cut back on his / her caffeine consumption. great tasting coffee and great deal. can spend over $ 5 for it at the grocery store. i get mine by the subscription plan for a little over $ 4 plus no tax.
1	we have several of these machines at work and i &apos;ve tried lots of different flavors and blends ... this is one of the few i can keep down without my body convulsing with an involuntary shudder. lots of these instant coffees are very bitter or far too strong. this one is actually very tasty.
1	this was a very interesting drink ! it was refreshing , tasty and healthy ! it was very tangerine tasting , no after taste and very refreshing !
1	i tried these bars and they were very good , although i do like the peanut butter chocolate chip bars better. the bars are a quick and easy to carry snack when you are on the go !
0	food is very much a personal preference but i really don &apos;t like any of these crackers made by this company. they taste like flavored paper. someone said better than nothing but i &apos;d rather have something else.
1	this mix is probably not something you would want to use everyday. its just new enough and different enough to be something special to add to your summertime recipe &apos;s. when you want to reward yourself with something fun and fruity , this can fill the bill quickly and easily. it has no aftertaste so often associated with diet drinks. i highly recommend it.
0	this is one of my favorite cereals. but purchase it only if you don &apos;t mind eating it in powder form. what you get is mostly powder , not crunchy squares. i will not be ordering again , sorry.
0	i have a bichon and i thought this would entertain him for at least 15 minutes , but it didn &apos;t. he solved it quickly , within 5 minutes and looked at me as if to say , that &apos;s all ?
0	by the time these little rocks tell you that your plant needs water , your plant will be dead. great idea and just didn &apos;t pan out.
0	my son wouldn &apos;t eat it either ! i tasted it ... i would not eat it , also. tasteless , unappetizing in texture and flavor. it says &quot; minimal processing &quot; ... does that mean it is not even cooked ? no wonder our babies and toddlers hate it ! ! ! i would never knowingly feed my child or myself raw meat.
1	these beans were vacuum sealed , very fresh and supple. my only problem was that there were so many i had way more than what i needed for a dozen jars of vanilla flavoring that i &apos;m preparing as christmas gifts. highly recommend.
1	everyone should try these chips. they are healthier than regular chips. and they taste good.
1	as a professional potato chip muncher , i see these as thee very best on the market. rich taste and flavor ! ! almost impossible not to finish the entire bag.the true meaning of decadence !
0	i transplanted a ficus to a larger pot ( no gnats previously ) , and soon after our bathroom was infested with gnats. i like the response i get from my plants outdoors with miraclegro &apos;s potting mix , but i will never use this again for indoor plants.
0	these were a little disappointing. the hot chocolate is very watery and the flavor is a bit strange ... kind of plastic tasting. haven &apos;t been able to find a good brand of hot chocolate for keurig
1	i have purchased other hot cocoa cups but find grove square to be about the best of them all. i usually add two teaspoons of the the flavored coffeemate creamers , my favorite being the sugar free caramel macchiato. by adding the sugar free creamer the taste is there but not the calories.
1	the breeder of my puppy uses this , and i continued to feed with this supplement. dog loves the taste , and makes her boring dry food more interesting- she gobbles it up. i notice her coat is beautiful. good ingredients. i would recommend this.
1	these things work very well. the only trouble i &apos;ve had with them is if you leave one in the machine overnight , it sticks and is hard to get out. otherwise , a great product ! ! !
1	these are some pretty darn good nuts with some spicy bite. they wont change your life , but they are good. the double entendre in the name is a serious bonus.
1	have only had the need to use this a few times , but it has always performed well and consistently. nice that it has a little preamp so you can control levels - doesn &apos;t seem to color the tone in any negative way.
0	with both a stomach problem and a love of coffee , i thought this would be a great solution. i was wrong. i just didn &apos;t care for the taste. i recommend trying some low acid coffee once somewhere you can get a small cup before purchasing a 10-pack of bags for home brew. : (
1	i had only tried the barbeque and sea salt and vinegar flavors that were available at my local target in 3oz. bags. i am so glad that i bought this variety pack ! not only did i discover other flavors that i enjoy , but it &apos;s single serving size so it &apos;s better for portion control. i love popchips , and i find them way more satisfying than ordinary potato chips !
1	this product is a quick snack very light and tasteful with any spread or just like it is. takes up hardly ay space if a couple of packets are placed in your bag. individually wrapped crackers makes it stay fresh for longer periods.
0	my dog had this for 30 minutes before he chewed through the knot. he then went on to chewing the rubber off the nozzle. my dog was 9mo old and weighed 26lbs. loved the idea of it. disappointed that i spent $ 12 on a toy that lasted less then an hour.
1	i have tried all the different brands of coconut water and o.n.e. is my favorite and o.n.e. coconut water with a splash of pineapple is my favorite flavor. i wish the price would come back down i absolutely love this stuff !
1	i already have the bluebird from blue and was using it to record a friend &apos;s live performance. with only a laptop computer at my disposal , i was able to connect my xlr to usb directly into garageband. the icicle is small , portable , and so easy to use-- plus , i didn &apos;t have to carry a huge a to d converter !
0	these are so not tasty. it is like eating a green tea bag with peanut butter and chocolate. i do not recommend purchasing these.
0	although the description states that the salt-free version of cavender &apos;s contains no msg , beware. i sprinkled a little of this on beef last night while cooking it , and my intestines are still talking back to me 12 hours later ! &apos; flavor base seasoning &apos; and &apos; five other spices &apos; are both mystery ingredients in this mixture , that probably contain msg. not for msg sensitive people !
0	i ordered this plant as a gift for a friend and was not told until recently that the plant had died shortly after she received it. she said she followed care instruction but the leaves started to fall off and it wilted and died. i wish i had known sooner but she just told me last week.
1	kellogg &apos;s mueslix had replaced local muesli previously served in european b &amp; b &apos;s on our last trip. not available locally , but amazon provided with a fair price , rapid delivery and no shipping cost with my prime shipping. excellent form of muesli !
0	i wasted my money. i tried putting different cereal , dog foods , etc. in this , and my dog ignores it completely.
1	since being diagnosed with high blood pressure , this product has been a staple in our home. i especially enjoy the grilling blends. for the price i got it for online it was a great deak , usually much more expensive in store , so buying in bulk from amazon is the way to go.
0	used to subscribe to this item , as my dogs loved them , but i just found that they are made in china. i will never feed these to my dogs again or buy anything from the company.
1	try these first for all your seafood soups and stews. they &apos;re just amazing. the flavor enhances all your seafood and just makes it wonderful. plus , these are great just to snack on out of the bag. kids love them ! we use them for chilis , soups , and recipes as well. highly recommend !
1	i like all the varieties except the salt and pepper. they taste too much like black pepper and nothing else. the others are very goodl &lt; a href = &quot; http : / / www.amazon.com / gp / product / b001rvfdoo &quot; &gt; popchips 6-flavor variety pack , 0.8-ounce single serve bags ( pack of 24 ) &lt; / a &gt;
0	if you like cheese seasoning on your popcorn , this product will not deliver. it tastes like they should instead of putting anything cheese related on the label they should say , &apos; improved salt flavoring that will stick to popcorn more than salt &apos; . i would recommend anything by kernal season &apos;s brand ... that tastes like cheese. but if you like a salty tasting popcorn , this is the seasoning for you ...
1	these crackers are perfect ... you know why ? because they have a subtle light flavour that doesn &apos;t overpower whatever you &apos;re eating on top of them ... whether it be guacamole , hummus , or mustard and cheese ... : )
1	great on any thing from rice to pasta to burgers. i cant wait until the week end for my favorite over easy eggs , hash browns , and this mix. more heat than you would expect , have tried a couple other brands , not the same ....
1	this is by far the most delicious snack you could ever have ! ! the almonds are super fresh and crunchy and the light coating of syrup is not too sweet. my whole family loves it ! !
1	since i cannot eat sugar , and there are so few healthy options out there , this is perfect for my chocolate fix !
0	i bought these cookies after reading all the rave reviews but they were very dry , didn &apos;t have much chocolate , and left an unpleasant aftertaste. i don &apos;t understand what all the fuss is about. if these were the only gf cookies available , i still wouldn &apos;t buy them again.
1	good things come in small packages ! ! this is an excellent non-soda thirst quencher. no sugar but an outstanding taste ! !
1	our local stores all stopped carrying this product and were putting their own imitation brands on the shelf ...... just not the same ! great that i could order and have my cereal within days !
0	great product - 5 stars but my review is on pricing only. you can buy stubbs marinade at a whole foods ( a.k.a. whole paycheck to some ) for $ 4.49 / bottle.
1	if you want a really good snack bar try these , they are healthy and taste as good as any granola bar , but without the gluten ! ! i buy these regularly.
1	i purchased this product because i have previously used it and it is not always easy to locate on store shelves. i prefer it to other powdered custard ( pudding ) products for ease of making and taste. it &apos;s wonderful in trifles or just about any pudding type dessert you want to make. amazon gets the product to you almost immediately and at a reasonable price.
1	best one in k cups todate not watery like several of the others i have tried. will now join the subscribe and save group ! &lt; a href = &quot; http : / / www.amazon.com / gp / product / b005k4q64k &quot; &gt; grove square hot cocoa cups variety pack , k-cups for keurig brewers , 12-count ( pack of 3 ) &lt; / a &gt;
1	i &apos;ve been buying and drinking this for over a year now , and the energy boost is excellent , with a continuous , ~ 6-hour effect. the most recent shipments seem to have improved the flavor slightly as well , or perhaps i &apos;m getting more used to it. i don &apos;t drink it for the flavor , but it &apos;s not as heinous as the fake flavors found in the other , non-organic energy shots.
1	i ordered these a while back off of amazon. the mild flavor and firm texture is great. when they are available here they are about 2 / 3 &apos;s the cost of my local super market. they are always good no matter where i buy them. i just wish amazon kept them in stock all the time.
1	i have tried many brands of the hot chocolates but this by far has been the best. now , i realize it is thousand percent cheaper to just use the package you can buy at the store and add water but if you want to impress than this is the product.
0	i wish i had read that these are made in china before i bought them. they are going in the trash - lesson learned.
0	these lollipops are not as pictured. they came in assorted colors , some really drab , not the rainbow brights shown in the picture. they are also completely flat rather than being the rolled old fashioned candy style so they look cheap. i need them for a birthday party and i was really disappointed when i received them.
0	when i read that these were &quot; long lasting &quot; i was hoping for a chew that would take my take more than 2 minutes for my 9 month old chocolate lab and 9 year old lab to chew. not happy with this nylabone purchase !
1	this is excellent. this is the best gf mix i &apos;ve yet to try in over five years of trying it all. it &apos;s not grainy , none of that rice grainy thing going on at all. the texture of everything i &apos;ve used it for has been excellent. this is a winner. the price is a bummer , but the product is amazing.
0	was pleased with the packaging and prompt delivery however every single package was empty. no coffee inside. no broken seals or holes , just nicely sealed empty k-cups. would like coffee with my coffee
0	earth &apos;s best is supposed to be one of the best baby foods , but apparently my son does not have a palate for their food. maybe he did not like the texture of this stuff ( it looks gritty ) . he normally eats anything but was very sluggish with this food ... turning his head after a couple of bites.
1	i tried this before having normal red tea so i waited to review. the flavor still rings in my head it is earthier than rooibos tea and less frity. the color is that of muddy water , and it has the grittiness and viscosity of it as well. well worth every penny.
0	okay , a lot of chicken breast treats from china are causing dogs to be sick ( see the fda website for details ) . this is not one of them , but when i started buying it , it was made in the usa. now it &apos;s made in china. although my dogs have long loved this treat , i &apos;m in the process of searching for a replacement made in a safe country.
0	this one has a major problem. it &apos;s waaaay too watery , even at the recommended settings. the chocolate flavor is okay , and it &apos;s not overly sweet ( although it still isn &apos;t great dark chocolate flavor ) . the really issue is that there isn &apos;t any creaminess , and adding milk only dilutes the flavor even more. blech ! i &apos;ll pass , and i &apos;m throwing the rest of the box out.
1	this hot coca tastes pretty good when brewed on 8oz setting however its not the best i &apos;ve ever tasted nor the worst. its hard to rate this because everyone has different tastes so its ether you like it or you don &apos;t. i my self happen to like it and will buy again unless i find something better.
1	i love this tea. i have issues with added flowers and flavorings in other teas and revolution teas tell you exactly whats in it and there are no additives ! i have been ordering from them ever since my first box of tea. i take it to the office and i have a travel container and take it with me to restaurants.
1	this popcorn brings me back to days before the microwave version. what a treat it was to savor the taste and lightly salted lily white popcorn that was popped over the heat of a stove burner again.
0	i gave this product a one because zero wasn &apos;t an option. this is like a can of generic tomato soup with some overcooked bits of fish scraps in it. the only lobster in the soup was some shell. it was salty , fishy , nasty and inedible. not only that , but 11 of the 12 cans were dented. a complete waste of money. beyond disappointing. it made me angry.
1	i adore these k-cups ! on a keto diet , it can be hard to find pre-made drinks that aren &apos;t loaded with sugar. with these guys , i can control the sugar content but still enjoy that perfect glass of iced tea.
0	the soup taste terrible. the picture with big chunks of chicken is extremely misleading. there is almost no chicken in the soup.
1	i first discovered &quot; gluten free biscuit &quot; in the supermarket. i bought it and loved it. i then tried to find it again in all the local supermarkets , but could not find it. i called the manufacturer and they informed me that i could purchase it at amazon. i was thrilled. amazon is one of my favorite web sites.
1	i brew the 8 oz cups , 10 and 12 makes it too thin. it &apos;s good at that point but adding some creamer , whipped cream , and or cinamin always improves it.
1	absolutely love the habenaro sauce ... use it on eggs , sandwiches most anything for a good kick ! have watched the progessing popularity of theis homegrown product ... have nothing but the highes accolades for the chef and the product .. get out there and try it !
1	i won &apos;t claim to be a professional food taster ... i just know what i like and don &apos;t like. i don &apos;t like &quot; yellow &quot; popcorn , i don &apos;t like microwave popcorn , i like the &quot; white &quot; popcorn cooked in a pan. for my &quot; popping style &quot; the baby white pops great w / o lots of hard kernels. &apos; nuf said.
1	i almost can &apos;t stop eating this cereal ... i eat it for breakfast and then in the evening , when i think i want something to eat and am really not hungry , i snack on these. after all , it &apos;s healthy , so long as i remembeer it &apos;s not healthy to eat a cup or more. enjoy !
0	we tried this formula because it is lactose free , my baby does not have any other issues , just lactose intolerant. we found that it smells bad , does not mix well into water and my baby would not drink a drop.
1	these k-cups are awesome. they taste no different ( personally , i think better ) than those which are priced three times as much ! i highly recommend this product !
1	kids loved it. great product at a great price. my little one can make her own hot cocoa without my assistance.
1	we love this brand of freeze dried fruit and veggies. they make it easy to have healthy on the go snacks for our 2 year old !
0	the product was very good. why i gave it 1 star was the poor packaging and all the broken cookies.
1	these taste great and are a healthier alternative. my favorite was the sea salt and vinegar. i probably won &apos;t order the other flavors again since i have a favorite , and don &apos;t eat potato chips all that often. but the variety pack was great to get to try them all.
1	great price for the 24-count , my dad will love this gift since he loves hot chocolate and drinks about three cups a day , quick to receive.
0	they were stale and hard. had to suck on them to get them soft enough to chew them. won &apos;t buy again.
1	this sweetner is the best , it brings out the true flavors in what ever you add it to. and it has great health benefts.
0	to make a decent cup of coffee i have to use two pods at a time. i prefer a strong cup of coffee even if it is decaf. what happened to senseo decaf ?
0	besides being smaller than runts , they look the same and have the same consistency. unfortunately , they taste nothing like banana runts ... nor do they even taste good. yucky stuff. trying to return with vendor.
1	this mix is great anytime. i love it. would recommend it to anyone that likes chex mix.
0	my son &apos;s celiac so we &apos;re very familiar with gluten free products. i bought these because i trust the glutino brand name but really , they &apos;re just not that great. we tried them once and that was it because they &apos;re bland and tasteless. there are better gluten free alternatives out there.
