0	i wanted to get some jerky and since i like buffalo wings i tried these. the problem is there is way too much salt , it &apos;s disgustingly salty , way more than normal jerky. i can barely eat it. if you eat a 3.25 oz package of these you will have eaten 1840mg of sodium , instant high blood pressure.
0	i ordered this item as i got to see it as recommended by dr.sears .. but the pack of 6 with this flavor doesn &apos;t work for my baby ... my baby didn &apos;t like the taste .. i don &apos;t know why : ( .. had it been packed with different flavors .. i would have atleast tried the other flavor ... as this item is not eligible for returns .. i am just wondering what to do with this ...
1	i love these disposakups. they allow me to use some of my favorite canned or fresh bean coffee in my keurig coffee maker. there is no mess , easy as using the regular k kups , just throw away when you are done making your coffee. love the convenience. i have just place a 2nd order.
1	product has similar taste of wheat pancakes without the gluten. even other family members not on gluten-free diet like it.
0	i hated this coffee. i &apos;m much more of a starbucks or peet &apos;s loyalist , so maybe i &apos;m a bit spoiled. but after reading many positive reviews of this company i decided to give it a try. big mistake. i had a hard time giving it away. it definitely tastes like chicory. blagk. bad news.
1	a bit dry but still good. they may be perfectly all right ; i just thought the noodles were hard and dry. i &apos;m still enjoying them.
1	this coffee was really good. been trying to find it in new york , but haven &apos;t been able to. i think it &apos;s worth the few extra bucks to get it delivered. i &apos;ve ordered twice now and each time the coffee comes fresh and still very aromatic. also , i think the caffeine content is pretty high , as i &apos;m more awake on this brand then other brands like starbucks and fairway market brands.
0	i have purchased locally many other flavors of da vinci syrups , and ordered blueberry online to try it , because it isnt available locally- and i love blueberry ! well , this was a disappointment to me- very very sugary sweet with little blueberry flavor ; not to mention i paid 4x what i would pay locally. # very disappointed
1	my dogs go crazy over liver biscottis. they are nice and crunchy which helps clean their teeth and all the ingredients are wholesome.
0	this was a very disappointing coffee. it is very weak , i had to set my brew to a medium just to get any flavor from it and large is very watered down. i would find something different before buying this again.
0	i thought this was a jamaican blend or roast , but turns out it &apos;s simply a heavily flavored coffee. the flavor tastes artificial - like fake maple syrup flavoring. we have three coffee drinkers in our house and none of us could get past the first few sips. now i have to find a home for the rest of it so it doesn &apos;t go to waste.
0	holy cow ! i have never seen this much grease in a boxed product like this ! also , it has enough salt to kill an entire family of slugs ! use it in your garden , don &apos;t eat it !
0	unpleasant taste. i wouldn &apos;t say &quot; bitter &quot; but just &quot; off &quot; for me. it had an intense-strong taste but lacked depth if that makes any sense. wish i could be a fan , but it wouldn &apos;t be a choice i would make in the future. on the positive - their label is cute !
0	on an empty stomach , in a controlled environment , with plenty of water , i felt no physical change to stress levels , at least not the way that you feel an immediate sense of relaxation from xanax. like homeopathic medicince ( highly diluted ) , this product is bunk. but it tastes good , and maybe it could have a little placebo effect.
1	i use this coffee in my espresso maker and all i have to say it wow ! the espresso is smooth , with a hint of chocolate and slightly bitter finish. it &apos;s the perfect coffee bean for espresso for me. i hate that strong bitter finish you get with some espresso beans ( like starbucks ) and you don &apos;t get that with this coffee. i love it and will be ordering more !
1	we absolutely loved the chips and after ordering them from amazon we were able to find them in target. they have a really good flavor and we would eat them even if we weren &apos;t trying to loose weight. recommended by weight watchers.
1	as far as single serve cocoas go , this is one of the best. i wouldn &apos;t say it &apos;s as good as some of the handmade ones , but it &apos;s still good !
1	i like to put wild rice in many dishes. this is a good buy and easy to drop into other rice dishes or soups.
1	the product arrived quickly. all bags and chips were in place ... and safe ; -d these chips are delicious and only four ww points !
1	this product was a gift to a far distant relative. it arrived right on schedule , in perfect condition and she loved the choices inside the basket. i cannot attest to the food personally , but she loved it !
1	i like the bisquick , it works great in a variety of uses. wish it came in a bigger box , the recipes are good on the box though.
0	these crackers taste absolutely delicious , but leave a coating / aftertaste in my mouth that lasts for a long time. also , they contain msg and for some people ( i &apos;m one of them ) it causes a headache. the last time i binged on these crackers ( and they are hard to put down ! ) , i ended up with a crashing headache. be forewarned !
1	i have tried a few of the cocoa cups and find this product about average. unless you stir the cup the cocoa will taste watery for a few sips.
0	i had so hoped they would be close or better than cheetos flamin &apos; hot but they aren &apos;t. they were not past the expiration by 3 months but they did taste stale and almost flavorless even though you get a tiny after burn. i gave the rest of the case to the food shelter.
1	my baby loves this apple sauce. he didn &apos;t like the gerber brand at all , but yummys this down right away and i like that it is organic.
1	i have bought this product before. these snacks are crisp and great tasting. also low in calories. i recommend them highly. they are shipped almost instantly and arrive within a few days.
1	great snack and good on salads. it &apos;s dried peas , what else can i say ?
0	i expected better. flavor is o.k. but half of the rinds do not puff up no matter what the timing in the microwave.
0	my favorite coffees are the big dark roasts like french , italian , and full city. this k-cup dark roast has a big , bold flavor , but lacks balance. the level of smokiness , bitterness , and acid are way too high , and the result is not enjoyable. i liked the dark roasts. for the keurig from green mt , newman , and donut shop much more than this one.
1	my mother and father were the recipient of these wonderful pieces of chocolate heaven. they didn &apos;t believe they deserved receiving these , but i know they did deserve to receive these !
1	after finding out two of our family members have celiac disease , we had to give up licorice and cherry nibs. candy tree &apos;s organic cherry bites have no sugar and truly rival the cherry nibs with gluten. after a year of not having the &quot; real thing &quot; my husband believes candy tree &apos;s are actually better.
0	i ordered the teenie pack of greenies that was supposed to come with 96 teenie sized chews. i ended up receiving a pack with 52 teenie sized chews and 8 large chews. i returned the product because i did not receive what i ordered. amazon couldn &apos;t replace my order because they couldn &apos;t guarantee i would get the right product if ordered again.
1	how good these cookies really are. they &apos;re delicious , satisfying , and really , really healthy. definitely a great alternative to &quot; real &quot; cookies.
1	i have lived out of the us for over 7 yrs now , and i so miss my twizzlers ! ! when i go back to visit or someone visits me , i always stock up. all i can say is yum ! sell these in mexico and you will have a faithful buyer , more often than i &apos;m able to buy them right now.
1	my wife just loves these cups. first off i have to say they arrived a month earlier than stated. excellent ! the convenience of being able to use your own coffee and throw away the little cups afterwards is fantastic. no clean-up. excellent.
1	like the flavor and it &apos;s thick , unlike some fat free dressings that are really runny.
1	this is the best clam chowder ever. come originally where this is produced and was so happy when i found it on line. keep this in my cupboard at all time. being an old maine girl this is my favorite chowder of all times.
1	i bought these chocolate liquor cups for a party ! it was a big hit. they are high quality and a good buy.
1	great product ! love making this during the fall and winter months because the smell goes through the entire house reminding me of christmas. taste great too especially when warm and with cream cheese. have made it for co-workers who always rave about it. it &apos;s easy to make up , too.
1	mine came with stickers to sell them for $ 1.59 but they cost more like $ 1.25 so if for retail that is not much of a mark up. i bought these for myself so that doesn &apos;t really matter and they are cheap. similar to lay &apos;s but cheaper. unlike other knockoffs these seemed to taste fresher and the convenient size minimizes stale chips. great product. great price.
1	works fine for my podcasting needs. i use it with a sure sm58 microphone. it is made of plastic and does feel cheap but i have had it for a few months and had zero problems with it. for desktop use it should be fine. works great for my needs. wouldn &apos;t recommend for heavy use on a stage or being tossed around.
0	i got sent the wrong item , which happens i know. i tried to contact the company multiple times with no response. i finally had to contact amazon and they are returning the item for me ...
0	found my kids actually cutting open the pods and dumping them into a cup to add hot water too. they complained that lots of the good stuff stays in the pod. kind of defeats the purpose of the packaging , so we switched back to packets.
1	i &apos;ve used natures logic dog food for about a year. the difference in my dogs is impressive. their coats are like silk. what a wonderful product !
1	i &apos;ve always bought yellow popcorn , but after reading the reviews for snappy white i decided to give it a try. it &apos;s tender and delicious ! i &apos;ll be ordering more , it &apos;s now my favorite popcorn.
1	no harsh after taste , no tangible negatives. it just doesn &apos;t have the &quot; bite &quot; that i crave from other carbonated beverages like ginger ale or root beer. it &apos;s a good option for a healthful drink with some fizz.
0	my 3 month old jack russell terrier totally love it ... but it last for an hour or so. look on the customer pictures to see what i mean.
0	my son used to love the chick chick , gobble gobble , and super salmon. but they changed the recipe , and now it &apos;s more corn than anything else. taste is bad too. nutrition value is lower. he doesn &apos;t like it , and neither do i. i am totally pissed.
1	this has to be one of the best teas i have ever tasted ... it &apos;s clean , bright , fresh ... great delivery ... again quality ... just try it ...
0	i felt energized within five minutes , but it lasted for about 45 minutes. i paid $ 3.99 for this drink. i could have just drunk a cup of coffee and saved my money.
0	i thought the whole figs would be softer for spreading but they are not. you have figs laying in a very sweet syrup. i &apos;ve only tried it on toast one time and it was way to sweet to eat. the figs just lay on top unspreadable. i would not buy again. save your money.
0	i believe that this product is old / expired or being stored incorrectly. only about half the kernels popped and the kernels that did pop had an odd chewy / stale texture to them. i would not recommend buying from this company.
1	i love this organic raw honey ! when using it in my tea i don &apos;t need a lot and the taste is great. honey is also helpful with moisturizing and healing so other than consuming it i also use it on my hair and face often. the darker the better.
1	great oysters , fast shipping. can &apos;t find them local so i took a chance and they were great ! they were frozen when i got them and package was well packed.
0	i was very disappointed that this coffee did not have much coconut taste at all and now i &apos;m stuck with 4 bags ! i tastes ok as plain coffee but that &apos;s not what i wanted. i think if you gave a cup to someone and didn &apos;t tell them it was flavored they would think it was plain coffee.
1	these are one of my favorite ways to eat grains plus they are a good source of protein. 17 chips per serving is just about right. i wish they had a little less salt but for the calorie / fat / fiber content , they are pretty healthy. great with soup or salads or just plain. i would definitely recommend these.
0	carabou mahogony is the worst tasting cup of coffee i have ever had , and i &apos;ve been drinking coffee for over 4 decades. it tastes just like a piece of burnt toast. the only way i can make it palatable is to put it over ice , add lots of vanilla sugar syrup and milk. i &apos;ve got to find some way to justify the purchase and icing it seems to help.
1	recieved the truffles in one day shipping the customer service is over the top ... i opened the jar and enjoyed the aroma , i will shop with them again
1	great taffy at a great price. there was a wide assortment of yummy taffy. delivery was very quick. if your a taffy lover , this is a deal.
1	this olive oil is great. tastes very good and is outstanding for use with bread , pasta , and for cooking in general. love the flavor.
1	if there is one thing our dog likes , it is the liver biscotti dog treats. these make the best rewards and training treats we have used.
1	we use our keurig every day. when a friend gave us a sample we went crazy , it is the best hot chocolate ever. i highly recommend this , it is a treat in the evening to take the place of dessert.
1	i prefer the taste of this over the alcohol-based vanilla extracts , particularly in uncooked items and beverages. it has a fairly thick / syrupy consistency.
1	i love this kool-aid mix and they stopped selling it at my local albertsons ( boooooooooooo ) luckily i found it here and it is even cheaper than it was in store ! !
0	i suppose some people might rate this product higher as it is a great substitute for bisquik , however i didn &apos;t like it because everything i made from it tasted like bisquik.
1	it &apos;s always wonderful to be able to give chocolates as a gift and to receive them. it &apos;s great to know that you can send someone some chocolates with the guarantee that they don &apos;t arrive all melted. good service and excellent chocolates !
1	this oil is wonderful. i &apos;ve had almond oil that was so strong it overwhelmed what i was using it for ( salad , cooking ) . i loved the flavor of this oil and will be buying more.
1	the price on this product certainly raises my attention on compairing amazon price with the local stores. i can get a can of this rotel at my local kroger for $ 1. dissapointing !
1	got this free with another order i placed. i couldn &apos;t believe how much the cats loved it. i will buy again for sure.
0	the product stinks and that &apos;s mildly stated. the caps do not snap on easily and if you apply too much pressure the cup part caves in and you end up with ground coffee everywhere. i threw the whole order into the trash and called it a day. i will be using professionally produced k-cups ( i.e , dunkin donuts , starbucks , even folgers ) from this point on.
0	this product gave me a horrible rash. it contains both soybean oil and fragrance which are allergens. they need to list allergens.
0	i had high expectations but it was extremely salty and tasted nothing like movie theater popcorn. next time i try popping it ( i do have 23 more packs to go through ) i &apos;ll try cutting back on the salt in the packet. i don &apos;t know how this popcorn got such ratings. i &apos;ll give it another shot though out of the love i have for popcorn.
1	these are delicious. they have the same consistency as a spree or runt , and they are sour all the way through. i &apos;m sure i &apos;ll be ordering some more.
0	as coffee in general , this wolfgang variety was alright. however , i was expecting a &quot; creme caramel &quot; taste , or something similar , and i don &apos;t feel this delivered. i tried multiple cups at different cup sizes and this coffee just didn &apos;t do it for me. it is marketed as a flavored coffee , yet i could not taste anything beyond the flavor of coffee.
1	i like the ease of this mix. i haven &apos;t tried anything but pancakes. they were great ! i did add cottage cheese to my mix to add protein , which made them less fluffy but not less tasty. i can &apos;t wait to try this mix for chicken. i really miss fried chicken.
1	i don &apos;t understand why this dog food is not full of reviews. checkout &#91; &amp; # 8230 ; &#93; they give this dog food 4 out of 5 stars which beats science diet and purina one which i use to use and diamond natural is less expensive.
0	if this is supposed to be a top notch dog food , my dogs sure don &apos;t think so. there is a very odd smell to this food , it almost smells as if it is bad. same smell came from the bison flavor as well. my dogs won &apos;t eat it. obviously other dogs like it otherwise they &apos;d be out of business. sorry i wasted money on 2 cases of this stuff.
0	i was excited to receive my movie theatre style popcorn. i was extremely dissatisfied when i received my item because it was old ! the oil was completely dried out &amp; the popcorn barely popped and tasted very stale. i feel like i wasted $ 17.00 !
1	so this bag of skittles is really worth it. comes with a load of skittles filled too the top of the bag. skittles is my favorite candy now i order the 3.5lb all the time. its enough to share and still have a lot left over
1	these are a great grab and go snack that satisfy. i love pop corn but don &apos;t eat it that much because my husband hates my breath while i am eating it at the movies , so i take grandpa po &apos;s originals instead and he keeps hogging the bag ! i know soy beans are healthy for you and this is the only way i enjoy to eat them. i love these ! ! !
1	this food is great - all ages dogs. i have a 3 year old and a puppy. they are both so soft and hardly ever get sick. the food is good especially when you have amazon prime shipping : )
1	i love these chips and ordered them after i had some in florida. my case of chips came without any packing inside. all bags in a box with no cushioning at all. needless to say most of the chips were broken and i would not order them again. a great item but if they can &apos;t package to aid in minimal chip breakage then one is wasting their money.
0	i did get a good laugh out of my one bone that i had ordered thinking i was getting a cute basket of bones for the 130.49 value .so do not let the picture deceive you as it did me.so this item is so not worth it . &lt; a href = &quot; http : / / www.amazon.com / gp / product / b000ihxml4 &quot; &gt; merrick smoked beefy jerky bone 2-3 &quot; &lt; / a &gt;
0	i love mashed potatoes. but i goofed on this batch. these are much too highly seasoned for my taste. betty crocker tried too hard to be distinctive. if she had let the poor reds be themselves they would have been wonderful.
1	this tea is very good. i discovered it while visiting in california. the moment i got home i searched local stores for it and i was not able to find it. finally i decided to see if amazon had it and they did and i bought two boxes. as long as they make it i will buy it.
1	delicious candy. outstanding price for such a rich product. the &quot; fortunes &quot; on the inside are an added bonus. great options relating to packaging.
1	great tasting product and is much better than other cocoas i have tasted in this type of single serve. job well dont grove square !
1	these are the best alternative chips i have ever tried. i have shared them with friends and relatives and they all agree. you get enough in the single serve packs to be truly satisfied and if you are a weight watchers customer , they are great , only 2 points for each bag ! ! !
1	i drive otr ... over the road truck and this helps to keep me alert. it has no sugar high &amp; no crash. i &apos;m on a autoship which i like. the price is very good. i &apos;ve seen it over 2 bucks in the store.
0	this is pretty retarded - how many have you sold , at double the cool , refreshing retail price ? you &apos;re a freak.
0	i liked these tubs for a few months and then realized that they contain fish oil and gelatin. why put these products in a vegetarion seeming food ? beware ! i &apos;m going to review all of gerber &apos;s products carefully now. totally dissapointed with gerber.
1	i have 12 month olds and no time to write a great review , but they like all the flavors , the textures are great , and the jars open easily. great on the go snack.
1	the popchips were great and they were fresh when they arrived. for the price , i wish there were more bags of chips for my bucks.
1	when i was talking to a neighbor about getting a keurig she told me not to get cocoa. this was in a group of beverages that i got when i ordered my keurig and i think it is very good. it is rich , creamy , and exactly what i want when i want a cup of cocoa ! i would order this again.
1	love this product ! it adds flavor to your water without all the nasty artificial sweetners. hope this product is here to stay !
0	i was in a hurry and did not read the reviews ... i trusted amazon &apos;s description and it did not indicate it was flavored coffee and that it was not jamaican ... it is very lightly flavored with vanilla so it isnt too bad. i feel cheated.
0	these are a cheap fake. nothing like the real emerald nuts you buy in the store. its a complete waste of money. dont get ripped off like i did.
1	i ordeed this product because this tea is really good. the shipment came as expected. i love the taste of this tea. it &apos;s not stong at all.
1	pretty good product. the taste isn &apos;t the best but it &apos;s definitely not the worse either. it gives a pretty smooth energetic kick.
0	i believe gerber may have mixed apricots with the peaches. it now has a sour after taste and my son hates it.
1	happy with this purchase , it &apos;s a good deal. it &apos;s the most fragrant coriander ever ! coriander is a super spice , tri-dosha ( and a health supplement as well , research it , it &apos;s a ground cilantro seed ) . we use it in lots of dishes. thank you !
0	the worst ! ! ! it is just plan awful bitter and strong and you cannot taste the hazel nut flavor at all ! ! ! ! ! do not buy this product save your money ! ! ! ! !
0	great idea , but my fido is so frustrated he lays there and crying and barking hoping the treats will fall out. still working on training him , but not sure this is good for his psyche. he &apos;d much rather unscrew the bottom if he could.
1	i read other reviews before buying and they are not encoraging .. but still for some reasons , i got to buy ( to use my amazon gift card ) . but then i am very happy with the purchase. delivery is prompt. quantity is correct . over all a few bucks savings than you buy at a retail shop.
0	a terrible product we follow the intructions and did not get the the pork rinds. we only got pieces of pork skin
1	i have ordered these raisins multiple times. they are always great and arrive timely. i can &apos;t go back to store bought chocolate covered raisins now ! love this product.
1	i am a chip fanatic , when i heard of these , i had to give them a try ! they are very tasteful esp. the bbq one &apos;s. i have yet to try the other flavors but i am sure they will not disappoint. i watch my weight / health so these are perfect , just becareful because they are addicting !
1	i &apos;ve tried 5-hour energy , red rain , nos , and other energy shots. this is my favorite in terms of taste and effect. plus , it &apos;s somewhat reassuring to know that natural ingredients are used. sometimes i wonder what i &apos;m really putting into my body with some of the other brands. i purchase a box about once every 2 months for the past 2 years.
0	something is not right. tastes very old. stale. weak. weak at 8 ounces. weak at 6 ounces. strength ok at 4 ounces but tastes horrible. not only will i not buy this coffee again , i won &apos;t buy green mountain coffee again. very bad.
0	there may be people who like blue cornmeal. i had never had any , don &apos;t know if it was supposed to taste like it did or not , but it was awful. don &apos;t sell any more of this , amazon.
0	i was sorely disappointed in these cookies .. they are pretty tasteless and damn hard too .. i wouldn &apos;t buy them again and i &apos;ve certainly tasted much better low-cal cookies .. i definitely recommend saving your money , folks ..
0	this is mostly concentrated apple and grape juice reconstituted with carbonated water ; it &apos;s extremely sweet and more caloric than soda. do people who consume this think they &apos;re drinking something healthy , or indulging in liquid candy ? or is this supposed to be used as a mixer , e.g. , for making daiquiris ?
1	this taste just like brown sugar with less sugar. i use this for everything , that requires sugar ( baking , est .. ) i use less of this than is required , like if it says use 1 / 2 cup i use 1 / 3 of splenda brown sugar.
