0	while i admit that the oversalted chip is addictive , i really think this one has gone too far. skin literally peeled off my lips and inside my mouth after eating these. i am surprised that they are still on the market.
0	i prefer my chicken cooked on a grill or pan fried. well , i tried shake n &apos; bake for the first time and thought it was just okay in the taste dept. not asying it was bad , i just was not my cup of tea. i &apos;ll be sticking with my trusty grill or frying pan next time i wan &apos;t some chicken.
1	these treats are the only ones my 14 year old dog will eat. she loves them.
1	this is our second time using your black winter truffles .... they are truly delicious. we throw them in with pasta and truffle oil to have the world &apos;s best dish ... reminds of our stay in tuscany. this is a quality product and we plan on buying again in the near future.
0	we have a year old pug who will eat just about anything but these ! unfortunately he just would not go near them no matter how hard we tried to peak his interest.
0	inexpensive little mat. but it &apos;s so small and doesn &apos;t help when my cat kicks litter out of anywhere other than right in front of the box. and like others have written its got little spokes poking out so my cat didn &apos;t even like to step on it so it made even more of a mess. it needed to be cleaned daily and it was just overall more hassle than the small price tag.
0	i found this canned pumpkin kind of bland and it needs extra spices to boost the flavor of it.
1	this product has worked since the first day i have had it. tremendous buy for me. i needed my mic to go directly into the computer. thanks.
1	much better than having to fight removing coffee grinds from a metal basket. i love being able to just toss grinds into the trash.
0	when a product is past its &quot; best by &quot; date , that fact should be revealed so we can decide whether to risk it. these were stale , hard , inedible caramels.
0	for the uninitiated , &apos; evaporated cane juice &apos; is just sugar by another name. another product that tries to present itself as healthy , but isn &apos;t really ... eating something that lists sugar as the second ingredient isn &apos;t what i would consider to be a healthy start for the day.
0	this coffee is great , don &apos;t buy it here , though. your local grocery store will have it for much less and your local sam &apos;s club will have it for less than $ 13.
1	this is just fantastic chicken noodle soup , the best i have ever eaten , with large hearty chunks of chicken , and vegetables and nice large noodles. this soup is just so full bodied , and is seasoned just right. i am so glad amazon carries this product. i just can &apos;t find it here in vermont.
1	this product is exactly as described. i use my keurig brewer daily and now i am able to use my choice of coffee. they are simple to use and work great. the delivery from liquibuy , llc on amazon was prompt and packaged perfectly.
0	the bottles were both leaking badly ; about half the product had leaked through the bottom of the box. unfortunately they cannot be returned , so i just wasted money ordering this.
0	really amazon ? ! nothing says delicious summer treat to me like a nice cup of egg nog ... and when i am not craving egg nog in the summer , it &apos;s gingerbread i &apos;d really like ... don &apos;t buy this , it sucks ... i &apos;m probably just going to toss it. if there was the ability to rate this with a negative number ... i &apos;d say -3
1	this jerky is the bomb ! ! ! it is by fare the best i have ever had and i have had a lot of jerky in my day.
0	don &apos;t know much to say except they smelled funny upon opening the bag and neither of our 2 dogs would go anywhere near them.
1	i , like most people , switched to organic after the dog food scare and after trying a lot of different foods , settled on this one. my dogs like it and i feel good about it feeding it to them.
1	its my daughter &apos;s favorite first and foremost. for me i love that i can get lentils , there aren &apos;t many stage 2 or 3 vegetarian choices.
0	i don &apos;t know what kind of coffee these people giving this stuff 5 stars were drinking but this coffee honestly tastes like the beans were roasted to the point of charcoal. out of 54 people that i work with , only two like it. i think somebody is getting paid to give this stuff a good review.
1	this was a gift from my lil sis. awesome. great flavor. can taste berries and rhubarb. i love it. most likely will order more.
0	ordered some from an amazon-fulfilled associate. normal amazon shipping etc ... the cigars were cracked and stale. how does chewing gum shatter and break ? no way it was fit for consumption. easy return process.
0	on top of the delightful aspartame , this comes complete with hydrogenated oils and is a dead ringer for country time lemonade mix.
1	super tasty quick meal. it &apos;s a bit small , but perfect for a lunch on the go. definitely not going to help you with any dinner hunger pangs though. the sodium is a little higher than i &apos;d like , but i really can &apos;t beat it for economic and efficient lunchfood.
0	this is for puppies the bag is super small ! ! ! the bag didn &apos;t last more than a day. i thought it was funny when i got the bag i thought it was a gift to be honest ! ! !
1	these crackers are a great healthy snack without anything spread on them. my only dislike is that they are a tad too sweet for me. i &apos;d like them without the molasses.
0	the product is of excellent quality and of great taste and is imported from india. unlike most of the items available in amazon.com , this one is overtly priced @ $ 23.99 when you can get it only at $ 8.99 in local grocery shops.
1	the product was exactly as i expected and the same as previously bought in retail stores.
1	like i said about the icing .... i am so happy to be able to buy this online. it is a family favorite , it also was shipped on time and arrived early. definitely going to buy again.
0	i really wish my toddler liked this. it seems to be very high quality and it would provide more variety in his diet. every so often he &apos;ll eat it , but it usually needs to be mixed with something else. i think it tastes fine , but it wasn &apos;t a hit. i bought a case so i keep trying.
0	the candy is just red , no flavor . just plan and chewy . i would never buy them again
1	everyone loves pocky and if they say they don &apos;t they are lying lol. the pocky arrived in good condition with minimal melting and very few broken pieces.
1	i received all the ingredients in a timely manner. all the ingredients were nicely packed and remained fresh through the shipping stages. it was more than i needed for the meal i was making , so i had plenty of left over ingredients.
0	this is a really good product but not a great price. shop-rite &apos;s normal price is the same as the subscribe and save price. they however have it on special offer so it is cheaper still , yet you don &apos;t have to buy 16 at once.
0	i have purchase a number of products from jack links and have been generally pleased. this item however was awful. it was old and mouldy. could not eat them.
1	excellent in cereal , or on top icecream sundae. i use them in my ramen noodle hot / sour soup as well. very very good. almost a lite peanut flavor. not too much salt , very lightly seasoned. a must try for anyone wanting a low calorie addition of protien into diet. even the dog loves them. thinks they are some special treat.
1	these arrived on time and packaged in green plastic wrap. the cookies were as fresh as the boxes found in the local grocery store. i have no complaints but i also now have no more cookies. we ate them all !
1	i love the metallic and sheen colors. in a photo , the items airbrushed with the silver and gold look real. the sheen really kicks the color up a notch.
1	it is hot ! i love it , tasty and a little sweet. i usually scoff at salsas labeled as hot , but this one lives up to its billing.
1	this is the first time i have found a us produced truffle oil that actually contains real truffle. a lot of other &quot; truffle oils &quot; just have &quot; truffle aroma &quot; ( whatever that is ) and a lot of chemicals that sound less than pleasant. you can definitely taste the difference as well.
1	great price and my cat loves this food. he has been on it for 9 years. my vet says he is the healthest cat he sees.
0	i am gf and appreciate any / all efforts towards new foods but this is dull stuff. making your own granola is super easy and takes very little effort. i &apos;ll take my $ 6 for this weenie package and head back to the kitchen.
1	i started using nustevia several years ago. back then i had to purchase it from a health food store. thanks to amazon i can now order and have it within a few days. i never run out ! as for the product , it &apos;s the best. i &apos;ve tried several stevia products but they have an after taste. not with nustevia. please try if you haven &apos;t.
0	i agree the jerky is way too salty and it has an unusual flavor. the package says hickory , but i have no idea what it is. i will try another brand next time.
1	i was browsing around on amazon looking for gifts and was very pleased to see my favorite sauce on here. i will just order and have shipped to my friends. habanero is my favorite , i love the heat and the tangy spiciness. i also love the pineapple. you will not go wrong ordering this up.
0	i hated this k-cup and couldn &apos;t wait to be done with the box. ( we hate wasting unless toxic. ) so while not toxic , the best i can say for this variety is that it tastes like bitter , yet weak &quot; sock water &quot; . now , after reading the many good reviews this blend has received , i &apos;m apprehensive to trust the reviews of the other k-cup varieties.
0	i can &apos;t believe i didn &apos;t check out the ingredients for this. i never would have bought it if i would have known there was artificial sweetener in it ! first cup though , i got that weird after taste it gives and that was all she wrote. if you don &apos;t have a problem with a chemical taste or concerns about health problems , you may like it. not worth it to us.
0	for some reason talking rain got yuppie , and changed the bottle from a short squat version , to a tall version that falls over. i used to buy these and would again if they brought back the old bottle.
0	i read all the reviews before purchasing. just received the mini sprouter tried to start using but the water keeps leaking out the sides. not sure what i could be doing wrong since its only 7 pieces that stack. very disappointing ! returning this asap ! !
0	after i purchased this for a gift , i was told that the enclosed cold pack had melted. soggy peppermint patties weren &apos;t the treats that i had intended to send.
1	this product is excellent. it &apos;s also a nut snack that my wife , who has celiac disease , and is allergic to wheat and glueton can enjoy. i however can eat anything and this is the tastiest and most unique nut snack i &apos;ve ever tried. al &amp; virginia weatherly 53996 luzerne dr. macomb , mi 48042
0	popcorn has grear color ( white ) but taste is average and due to shipping costing more then product , i would not buy again.
1	this filters are perfect to use with the extra ground coffee i have.they are as good or better than the k-cups.
0	medaglia d &apos;oro has to be the worst coffee i &apos;ve ever had. it had an old musty flavor and odor. you get what pay for.
1	i love this product cant find it locally. sometimes little out of the way stores have it.but i also love the chicken , pork chop bags.every store i go in i look for them the lastplace i found it was at a meat market.
0	this was gross. it lamb lund &amp; smelled bad. there hard chips. my dogs favorite is the texas taffy. thats a winner. i cut it into peices. she loves them.
1	i had never heard of this coffee before but i got a bag and really liked it. this melitta cafe riviera sunset decaf is a very good decaf with a good taste and body. this stuff is perfect for a late-night cup of coffee or for a cup with some dessert. its decently priced and i will definitely buy this again.
0	popcorn tastes old , and if you use the entire salt contents your popcorn is horribly salty. i thought it was just me but everyone who has tried it thought the same.
0	once again , paragon has disappointed with this flavor. the hawaiian tropic , simply did not carry much flavor , and what you could taste was not pleasant at all. i do not recommend this syrup concentrate.
1	grandpa po &apos;s originals scored big on our party &apos;s fun factor. these half-baked nuggets of organic popcorn blended with dry-roasted soybeans were a surprise hit with both kids and adults. our young nibblers approached this snack with a quizzical , &quot; what is this ? caution. but once tasted , the bowl was quickly emptied and our partygoers were eager for a refill. grandpa po &apos;s come in slightly unsalted and slightly spicy.
1	this is the pancake mix we go to when we don &apos;t have buttermilk in the fridge ( don &apos;t think the vinegar trick is worth it so we always do fresh ) to make alton brown &apos;s buttermilk pancake recipe. this stonewall mix is a good option and the flavor is the best of any store bought mix by far ! it might cost more , but it really is superior to the other prepared mixes.
1	this is a great product for us gluten free people. we use it for everything .... from pancakes , waffles , to cookies , scones , cooking.
0	i have purchased these in the past and enjoyed them. this whole box is old. the flavor is off badly.
1	great value if you buy it as a subscribe and save item , and i love that it automatically comes to me. these are great and they taste really good , making me think that we bought a very high quality product for our child.
1	my dog loves this food , and she has maintained her healthy weight for many years. the vet is very happy with her general health , coat , and teeth. having the 16lb bag sent directly to my home without any shipping charges is terrific ! the 16 lb. size is not available in my area.
0	sent this to my mother to help her out with groceries since she is on a fixed income. she said it was horrible and would be throwing the other 2 boxes out. so i would not reccomend this product.
0	i don &apos;t see how there can be good quality salmon in this or lentils ..... it is mostly potato and pollack ( substitute cheap fish ) --- this is really terrible for organic baby food - ugh , if i only had a cat to feed it to ....
0	this oatmeal is not good. its mushy , soft , i don &apos;t like it. quaker oats is the way to go.
1	sleepytime tea is one of those teas that can always be counted on. it &apos;s very mellow , with a great taste and smell. perfect for relaxing after a long day. this is the tea that all other herbal teas should be measured against.
1	this is a great product ! hats off to betty crocker once again. they are becoming a more &quot; main stream &quot; go-to company for people who are gluten free !
1	i threw my son a baseball themed party for his 1st birthday. what would baseball be without popcorn , peanuts &amp; get crackerjack ? ! item was delivered as promised &amp; the packaging was old school , which was appreciated by parents , granparents &amp; the even great grandparents ! item was fresh &amp; taste great !
0	i ordered this coffee and another brand , it seems , about three weeks ago. i checked this morning , february 8 , and found the deliver is out into march or apri. i paid for the product soon after it was ordered and have been told on checking delivery that it can no longer be canceled. wow ! ! ! ! !
0	it works reasonably well with condenser microphones. with dynamics the hum exceeds the signal. works with windows , not with linux. the build is very cheap. anything more than $ 5 for this is too much.
1	great coffee--this was way too much to pay for it , but i could not find it anywhere else at the time. i feel a taken advantage of price-wise and probably would not order again.
0	my kids loves chips ahoy ! and i will have them once in a while as well. but the kids refuse to eat them from this family size package. once i tasted them , i knew why. they have an awful medicinal taste. really bad. i don &apos;t what the problem is , but if you like chips ahoy , you will not like these. go elsewhere.
0	we tried this brand based on decent reviews &amp; price but were unhappy with the texture ; the popcorn is very tough. i will likely donate or toss.
0	the spaces are interconnected under the blue top , hard sharp edges inside and on the mobile lining ; and the dogs have a hard time getting to the food. my little guy actually yelped , i suppose he got his tongue caught. he did not go back to &apos; negative reinforcement .... &apos; not a good invention ..........
0	its not that this coffee sucks its that it doesn &apos;t begin to measure up to all the hoopla ! its well balanced but thats about it &amp; even a little old tasting nothing special in the least what sweet caramel finish ? can &apos;t believe this is the same coffee the 5 star reviews are about
1	i &apos;ve tried a few different hot cocoa brands for my keurig ... and have been disappointed every time , until now ! cocoa brews smooth and full flavored-on either the small cup size or the medium ! i add a splash of almond milk and i &apos;m ready to go : ) perfect ! i &apos;ll definitely buy this again.
1	these little gems are only 20 calories each and almost fat free , and taste way better than a rice cake , imho. i &apos;m glad they come in packs of 10 boxes because otherwise the husband and kids would eat them all and there &apos;d be none left for me !
0	love these kcups. box said &quot; 80 &quot; but contained only 35. please send me the missing 45 kcups newmans own special.
1	i had bought small cans previously and they arrived inadequately packaged , so they all had tiny dents. these , however , arrived undented , well-packaged in bubble wrap. i have not yet opened them , but i have used the small cans. this oil is great quality , and the price is not overblown. recommended.
1	mccann &apos;s oatmeal is a good quality choice. our favorite is the apples and cinnamon , but we find that none of these are overly sugary. for a good hot breakfast in 2 minutes , this is excellent.
1	i used the bisquick pancake and baking gf mix to make snickerdoodle cookies. they were very good and stayed fresh for some time. thank you for offering this mix.
0	it fits the right ball and it is just as &quot; everlasting &quot; as the other disks , but i really don &apos;t think this smells at all like vanilla or mint.
0	tastes - burnt , roasted , slightly rotten sunflower seed taste ; gritty , bland - no salt , sugar only seeds. would not eat if it was free. &quot;
1	since being gluten free i &apos;ve tried all types of gf breads and they are all very expensive. who knew that the brazilians had the bread game on lock with this inexpensive tapioca version of cheese bread ! it &apos;s custom which is probably why they are all so skinny ! lol but i loved it and will be ordering a whole lot more !
1	i really enjoyed this drink ! i am a lover of both orange juice and sunkist type drinks so i was very eager to try this drink. it is the perfect combination of sweet and fruity ! ! ! the tangerine i believe helps give the extra lift of the sweet taste. if you &apos;re trying to cut back on pop , i highly recommend this drink or even just for a refreshing treat !
1	these are a great snack for any dog who has food allergies to chicken. my 20 pound sheltie loves them more than any other chew or rawhide that we have given her. i highly recommend these for any dog , especially one with food allergies.
0	i usually order bustelo decaffeinated coffee and i am used to the taste being the same as regular espresso. i tried this lavazza decaf espresso and i am extremely disappointed. it &apos;s really obvious when you taste it that it is decaffeinated and tastes like it is processed. i ordered the 4-pack and would really like to send back the three that i haven &apos;t opened yet if i can do that ...
1	walnut oil is an essential ingredient in our favorite waffle batter. this oil is the best we &apos;ve used for the price. great aroma ! ! !
1	the walnut oil is really good. i later will often come to buy it.i hope you will like it too.
0	this listing sells the freezer tray for nearly $ 50 when all other retailers sell for 19.95. make sure you look before you buy.
0	not good coffee at all - i thought i was buying the donut shop decaf ( which is awesome ) but thought ill give it a try instaed of shipping it back ... it has a terrible chemically / stale type aftertaste. donut shop is way better.
1	i have done a lot of research to find the best food for my cat , and this is an excellent food. that is also according to my holistic veterinarian. they put probiotics on the kibble as the last step , which is very important to me. the best thing is that my cat loved it immediately and i had to stop mixing it with the old food because she only would eat holistic select.
0	i had hoped that this would still have a rich flavor without an acidic burn , but it just tasted bland , old , and stale. i actually couldn &apos;t drink an entire cup and threw out the rest of the package i got as a vine member. i typically prefer a rich , strong flavor but often bold coffees have too much acid. this had no richness or flavor.
1	this is really great hot chocolate. the price is right too. usually i find that hot chocolate k-cups are weak or watery but not this one. i was impressed. the dark chocolate is really yummy ! i will be ordering more.
0	i &apos;ve tried a lot of different k-cups and this is the weakest k-cup coffee i &apos;ve ever tried. it should not be labeled &quot; medium roast &quot; , it should be labeled &quot; warm water tasteless &quot; roast. too bad i bought a large box. what a waste ...
1	these chips are perfect for snacking with or without salsa. the texture is brittle and thin , like other plocky &apos;s chips. the only downside : the spice is minimal.
1	got this for my brother who is on jorge cruise diet and decided to try one for myself. it actually tastes pretty good.
1	this is a hefty roll of mylar ! the 50 &quot; width allows more coverage , obviously , but the 1 ml thickness is what &apos;s really nice. it &apos;s not flimsy !
0	totally not worth paying for. even my kids hated this stuff. very cheap cocoa in tiny tiny tins for too much money. i could have gone out and bought twice as much swiss miss , and enjoyed that a whole lot more.
0	wolfgang puck &apos;s &quot; breakfast in bed &quot; is a much more flavorful and robust medium roast than this one.
1	if you like goat cheese and smoked cheeses you will love this. it has a very smokey creamy flavor. try it spread on crackers with a little black truffle oil.
0	the product was simply not recognized by my windows 7 home premium computer. very disappointed , considering on the blue website it says that it is. i gave this the extra star because im sure its a great product , but the lack of communication of the compatibly was very disappointing. most likely wont be buying anything else from blue
1	i was born and raised on the east coast trenton - new jersey ) . i have loved tasty-kakes my whole life , so its a great present to find some mew flavors or twists on old familiar receipes.
0	sorry , i saw absolutely no benefit in taking this product. i never felt better or worse. lost or gained weight. it took it for several months and quit because it obviously wasn &apos;t doing anything.
0	don &apos;t you know that sugar is the sand of time ? since the ingredients of kavli crispy thin were listed on amazon , and the time i received my order , sugar was added to this product. you are going to get in trouble , mister.
1	i &apos;ve been enjoying this tea for years. this tea is good mornings , afternoons or evenings. my local store went out of buisiness .... thanks amazon ! i use a bodum tea press to prepare a pot.
0	i think this chunky chili is the worst store-bought chili. the meat has the texture of artificial soybean meat and is chewy , the sauce is too sweet and cloy. this has no character. i prefer hormel or dennisons to this. by far.
0	this soup is very very sweet. they left out the salt but it is full of sugar. there is 14 grams of sugar per serving with two servings in a can. too sweet for me. also there is dairy butter in it so it is not vegan or for someone with dairy allergies.
1	these baby gummy bears are by far the best i &apos;ve ever had. i had first purchased the 1.5 lb bag here , on amazon , but i realized as soon as it arrived that it wasn &apos;t going to be enough. however 5 lbs on a subscription basis ? oh yeah.
1	these are great tasting and have good consistency and meatiness. easy to eat on the run ( no mess ) .
1	in my book. you can eat one serving with ease and not feel any remorse. just wish that there were more bbq and cheese flavored selections. the black pepper is the bestest yet.
0	despite what the previous , obviously fake reviews claim this product doesn &apos;t do anything to prevent hangovers. drink water instead and save yourself $ 24. no such thing as &quot; toxins &quot; . psuedoscientific snake oil.
1	for some reason they stopped selling this in stores in fort worth. this is my favorite for chicken.
0	not one member of my family , including me , like these extremely salty , much too strong a bq taste to order more. i purchased them on a recuring basis and i wish to cancel now. i have received only one shipment. cancel further shipments. not to our taste at all. these are lowery pork rinds.
