1	personnellement je trouve que c'est une série formidable avec de l'action , du suspense , des énigmes , de l'imaginaire et d'autres choses encore . c'est la meilleure série que je n'ai jamais vue ! ! ! j'adore lost et bravo d'avoir eu cette idée car jamais une série n'a été aussi passionnante ! ! ! merci .
0	"toujours plus con , toujours plus navrant , "" joséphine ange gardien "" ressemble à une blague orchestrée par tf1 . mimi mathy mériterait deux paires de claques ."
1	cette série est géniale , je conseillerais à ceux qui ne l'ont pas encore vu d'y jeter un oeil ça vaut le détour . en plus les acteurs jouent très bien je souhaite longue vie à cette série .
0	fait illusion le temps d'une dizaine d'épisodes et deviens ensuite vite lassant .
1	vraiment une bonne série , rien a voir avec one tree hill , on s'accroche vraiment au perso ...
0	bonjour , voila une série qui a mal veillie ... du n'importe quoi vers la fin , allie qui devient maman .. moins de démance etc ... heureusement , dans ce cas la , il y a une fin à tout ( es les séries )
1	excellente serie ! ! c'était vraiment gonflé de faire une série pareil ! ! elle peut plaire à tout le monde ( sauf à ceux qui ne supportent pas la vue du sang ! ) il y a de tout : enquêtes , secrets , drame , histoires de famille , sexe , humour , morbide , trahisons . le tout est un mélange à la fois subtil et vicieux . a voir ...
1	bonne série , sauf que la saison 1 était la meilleure . dans la saison 3 on a des réponses aux questions des 2 premières mais les intrigues semblent sans suite et non abouties . cependant vivement la suite de la saison 3 car cette série sort tout de même du commun ...
0	cette série est le véhicule des idées puritaines et conservatrices de l'amérique qui offre le temps de chaque épisode , un regard moralisateur sur tous les possibles écarts de ces jeunes bourgeois de haute catégorie . on dirait jag , les uniformes et l'action en moins .
0	d'une stupidité surhumaine , cette lisa aussi naïve qu'agacante défie nos limites de tolérance . une série insipide au dialogue si peu naturel qu'il fait grincer les dents ! c'est d'une naïveté et d'une inutile compléxité ! déjà , ces dialogues infects et stupides nous pousse à changer de chaîne au bout de dix secondes . insupportable .
1	alias n'est pas une suite de missions ou il faut sauver la ville du méchant terroriste qui risque de faire tout exploser , le scénario est très bien ficelé au cours des saisons puisque chaque épisode se suit , avec des flash-back qui permettent de mieux comprendre les personnages , une mise en scène efficace , une interprétation maginifique , le suspense omni-présent , le mélange des genres et on obtient la meilleure série action des années 2000 .
0	tout simplement la meilleure serie pour moi qui est la seule a me faire penser qu'a ça pendant une journée après chaques episodes . et le travails des realisateurs est incroyable avec le nombres de details impressionants ! !
0	hier j'ai regardé et je n'ai pas trop aimé lépisode . je ne pense pas que je vais aimer cette série .
1	magnifique , grandiose , inoubliable , génialissime , drole , emouvant ... l'une des meilleurs séries que j'ai pu voir jusqu'ici . 10 saisons de pure bonheur , franchement je me suis tellement payer d'éclats de rires devant cette série ! ! je ne crois pas qu'on revera de sitôt une série d'aussi grande qualité .
1	premiere prenante avec un suspense haletant , une distribution de qualite et une bonne realisation ! petit le hero est un vrai mac gyver avec des truc partout un peu tiré par les cheveux mais bon c une serie !
1	une série que j'apprécie beaucoup , on est vite intérréssé par les histoires du docteur mamour et son équipe . les scènes de chirurgie sont très bien faite . une série donc sympathique .
1	franchement il fallait oser car ça fait pas rêver une série sur la prison . mais du suspense , une réalisation soignée donne une série originale à ne pas manquer .
0	la-men-ta-ble !
0	cette série est tout simplement inintéressante . toutes les idées ont déjà été développées dans d'autres téléfilms / séries et rien ne mérite le détour . on dirait une vaste opération commerciale un peu à côté de la plaque .
0	des series ds le secteur hospitalier qui se ressemblent toutes et qui ennuient ..
0	la saison 1 est géniale , du suspense , des trucs bizarres se passent et on se met dans l'ambiance . la 2ème saison est une grosse déception . pas de réponses à toutes les questions posées dans la 1ère saison , l'histoire avance à pas de tortue , on peut rater 3-4 épisodes et ça ne change rien . une grosse déception ! !
1	j'adore ! ! ! c'est vraiment une série géniale , les acteurs sont vraiment bons , l'histoire est super intéressante , mais c'est vrai qu'il faut suivre , sinon ça perd son intérêt ... jennifer garner est sublime , et victor garber incarne à la perfection son père qui joue un double jeu ... et l'histoire d'amour entre michael et sydney est très bien menée ...
1	je n'aime pas le football , mais alors là ... je suis stupéfaite par l'envers du décor , qui est si vrai ! les acteurs jouent tous très bien , les énigmes sont très prenantes ! j'adore !
1	super série médicale et sentimentale juste ce qu'il faut ! je ne suis pas du tout fan d'urgences mais là c'est pas comparable ! j'attends chaque lundi soir avec impatience .
0	elle est complètement nulle cette série . les actions sont trop lentes . on s'ennuie . c'est un copier-coller des autres séries américaines du genre à la française , le navarro à la sauce scientifique !
0	cette série n'a vraiment pas grand intérêt , les dialogues sont nuls l'action est quasiment inexistante , le jeu des acteurs frise le ridicule . c'est vraiment de la daube et dire que certains se permettent de la comparer à clara sheller , vraiment rien à voir mais pas du tout car dans cette série on s'ennuie tout le temps vu le manque d'action totale . une totale perte de temps à regarder !
0	une étoile pour la nostalgie . le reste ...
0	nul . j'aimais au début cette série mais je ne la regarde même plus . très déçu .
0	sans interet ! cette serie ressemble trop a toutes les autres du meme genre ! et surtout , n'est pas realiste !
0	pfff yavait longtemps ces séries à la noix , qui squattent encorent sur ab1 , depuis le temps , on sait qu'elle s'appelle hélène , on aura compris mais nous , impossible de lui faire comprendre qu'on s'appelle casse toi !
0	les tous premiers épisodes se veulent intéressants mais on se rend très vite compte que les seuls rebondissements qui rythment le scénario sont directement copiés des grands films traitant du milieu carcéral . l'ensemble sombre dans un véritable naufrage à partir de la deuxième saison où tout n'est que coïncidences en série et invraisemblences naïves .
0	ca sent le déjà vu à plein nez ... c'est mal joué , l'histoire n'est vraiment pas originale et les personnages sont trop banals . nul .
1	très bonne série , ces crétins déjantés mais tendres sont très drôles !
1	la meilleure série que j'ai jamais connue ! ! c'est une série culte ! ! ! les 6 personnages sont excellents , pleins de surprise au fur et à mesure des saisons ! ! ! dommage que la série soit finie ! ! ! je connais tous les épisodes par coeur et pourtant je ne me lasse pas de les revoir à chaque fois ! ! !
1	une série prenantes grace a un scénario sans faille , laissant le spectateur en haleine chaque seconde.en guise d'un tres bon scénario des acteurs qui jouent parfaitement leur rôle . bref une série que je recommande vivement .
0	cette série est d'une débilité , elle niaise , pas réaliste , je conseille cette série à tous les ados attarder
1	c'est la meilleure série qu'il existe ! une série de 10 ans quand même , ça ne se voit pas tous les jours ! les acteurs sont géniaux , les gags à se tordre de rire , bref , une série cultissime !
1	des personnages tous attachants , des acteurs géniaux , inutile de rabacher ce que tout le monde sait , friends est tout simplement , on ne le dira jamais assez , la plus grande sitcom de tous les temps ..
1	une série exceptionnelle , abordant des sujets peu ou jamais abordés . machiavélique à souhait , réaliste , marquante et immorale . un caractère de anti-héros que l'on ne peut s'empêcher d'apprécier tant il est charismatique . gravir les échelons à sa façon est jubilatoire . par malheur cette série comprend peu d'épisodes , mais un épisode pilote et des épisodes de grande qualité .
0	cette série est un véritable désastre videoludique , et je ne comprends pas les gens qui apprecient cette série ( il n'y en a qu'un seul remarquez ! ) . du début du générique à la fin de l'épisode c'est une cascade de scènes pathétiques et de blagues pitoyables , je crois avoir ri davantage quand j'ai regardé la liste de schindler ! ! ! bref à éviter à tout prix ! ! !
0	première saison plutôt pas mal malgré un dernier tiers bien poussif et ralenti . eh oui ! ... la seconde saison était en préparation ... et là , catastrophe , épisodes quasi immobiles , arrivée des personnages inutiles , des explications débiles sur la vie passée de certains ... tout pour aller à la saison 8 , vendre des chips et sodas pourris aux neuneux pendant les coupures pub ... dommage .
0	comment prendre des parties d'un scénario d'une série géniale comme ugly betty et en faire une daube . le destin de lisa est nul et il n'y a même pas l'humour de la série d'origine .
0	indigeste , horrible , nulle , lamentable , et j'en passe ! mais quel honte de nous sortir de telle daube a l'ecran !
0	au début , j'adorais lost . mais maintenant j'en ai ras le bol , c'est toujours la même chose , on se doute à chaque fois de ce qui va se passer au prochain épisode . je trouve que le réalisateur ne sait plus quoi inventer ! franchement , très déçue par la tournure qu'a pris lost !
1	cette série m'énèrve par son rythme ... mais j'adore çà ! ! ! lol ...
1	"j'ai regardé cette série du 1er au dernier épisode . le dernier épisode réunit tout ce qui fait le "" charmed "" de la série : humour , sentiments ... et bien sûr des sorciers . je voulais savoir si quelqu'un connaît le titre de la dernière chanson que l'on entend lorsqu'on voit l'avenir des filles ?"
0	j'ai vraiment detesté ! dès le premier épisode je me suis ennuyé ! bref une série qui ne vaut pas le coup et surtout qui n'a pas le profil pour avoir rempplacée lost la preuve est dans les audiances !
0	même si quelques épisodes font rire ( très rarement ceci dit ) , cette série est grotesque et je ne vois pas du tout ce que les gens trouvent drôle puisqu'il n'y a absolument aucun gag ... si le but était de faire une série historique , c'est raté aussi ...
0	en un mot c * * , il ya pa plus c * * ke cette serie.si on la compare a oz cette serie est de la vrai m * * *
0	une série totalement et génialement inopérante .
1	boston justice est très surprenante . l'une des meilleures séries d'avocats depuis ally mc beal ! les acteurs sont supers , le scénario est très bien trouvé . david e . kelley nous surprend encore une fois avec ses créations !
1	j'ai vraiment adoré dans ma jeunesse mais je trouve que ça a un peu mal vieilli . si l'intrigue suit toujours le même schéma , les combats sont bien chorégraphiés et les personnages assez charismatiques .
0	je ne vois pas pourquoi tout le monde crie au chef-d'oeuvre pour une série aussi banale et politiquement correcte ... ces femmes au foyer n'ont rien de plus subversif que celle de ma sorcière bien-aimée .
0	une grosse daube a eviter absolument temps perdu garanti
1	cette série est très bien ficelée , on accroche dès le début . il y a de la matière , le seul hic : y'a pas d'fin . ils auraient au moins pu faire un effort et rajouter 2 ou 3 épisodes pour ne pas laisser les téléspectateurs ainsi , c'est vraiment dommage .
1	voila l'une des séries les mieux foutus qui puisse exister.des intrigues absolument incroyables pour des personnage incroyables . c'est un vrai régale .
0	je n'aime pas cette serie car l'histoire ne va pas les persos son trop comment dire ils sont pas dans le role des personnages merci
1	une pléiade d'acteurs talentueux ( dominic monaghan , ian somerhalder , naveen andrews , maggie grace , josh holloway , daniel dae kim , yoon-jin kim ... ) et une histoire qui permet à chacun d'interprêter à sa façon la symbolique de l'île . mais au fil des épisodes j'ai commencé à m'ennuyer et à trouver les scénarios moins intéressants et moins intelligents . en espérant que la seconde saison sera mieux que la fin de la première ...
0	grey's academy est un pur plagiat d'urgences , en beaucoup plus niais et maladroit . des dialogues plats et ridicules au possible , des acteurs fades au jeu emprunté , et une musique décalée complètement ridicule ( j'ai remarqué qu'ils adorent mettre des slows lors d'opérations à coeur ouvert ... ) . bref , une série ennuyeuse et insipide au possible , parfaite pour ceux qui aiment perdre leur temps .
0	comme la plupart des séries qui passent sur m6 à cette heure-ci , c'est hyper formaté et à la limite de la débilité profonde . ils sont bien sympathiques , mais c'est lourd et très rarement drôle .
1	sincèrement , une très bonne série !
0	je vois pas pourquoi prison break est considéré comme série culte , j'ai juste regardé les deux premiers épisode et j'ai trouvé ca plat , c'est une des plus mauvaise série que j'ai vu , rien que le générique français est pitoyable , en plus l'idée de depart n'est pas extraordinaire , il faudrait arrêter de gaspiller de l'argent pour des séries comme prison break .
0	une série peu intéressante à éviter tout simplement ! !
1	super cette série , j'aime bien le côté qui nous fait prendre conscience que la planète n'est pas éternelle et qu'il faut en prendre soin . et puis on a pas besoin d'être écologiste pour s'en rendre compte . en tout cas la saison deux a bien commencé .
1	tout simplement génial , mais sa violence n'est pas a mettre entre toute les vues .
0	malgré les originaux rebondissements , la série reste ennuyeuse à mourir . a éviter absolument !
1	si la série manque un peu de moyens , on a le plaisir de retrouver kristanna loken , et on en apprend énormement sur les différents personnages ( quan-chi , mileena , les ninjas ... ) . vraiment très bien , à découvrir si vous êtes un vrai fan !
1	j'ai vu les deux premiers épisodes de cette série . j'ai apprécié le scénario , l'ambiance et le réalisme . les soldats sont perdus dans cet univers de terreur et d'horreur . les stéréotypes du super soldat ne sont pas présents . je conseille cette série .
1	de la bombe ! a voir et revoir ! un must parmis les must ! i love prison break
1	j'aime beaucoup cette série , mais je n'ai pas tout suivi , je ne l'a regarde que depuis la saison 3 = s mais je l'adore quand même ^ ^
1	excellente série ! que de rebondissements et de fous rires ! une série déjà culte , et quel plaisir de retrouver teri hatcher
0	sans commentaire
1	fan de star trek , j'ai été surpris d'apprendre que cette série s'est arrêtée sur des coups de gueules de fans . personnellement , j'ai trouvé st entreprise excellente , voire l'une des meilleures séries du moment.les personnages sont attachants , les intrigues très bien ficelées et l'esprit star trek y est vraiment présent . en résumé , merci à tous ceux qui ont contribué à cette série qui est un petit bijou .
1	super serie . entre freaks et lynch . trés etrange , deroutante , sombre ( trés sombre ) . serie à suivre . les acteurs y sont superbes et savent rendent credible leur personnages ( qui sont tous etranges les uns que les autres ) ! ! ! vivement la diffusion de la 2eme saion ! ! !
1	série superbe ! je trouve superbe cette équipe et comment ils procèdent .
1	drole et déconcertant , pour les amateur de légende , une vraie remise en question ! ! !
0	"un plagiat honteux de la série "" les simpson "" ! autant cette dernière est géniale autant "" les griffin "" est nulle . d'ailleurs écrire une critique sur cette merde est une perte de temps il vaut regarder un bon épisode des "" simpson """
1	super série , inégalée et inégalable , merci mr fontana
1	ayant vu les 4 saisons je ne peux m'empêcher d'évoquer la débilité légendaire des personnages de cette série . en effet on y retrouve des comiques des plus connus aux inconnus qui sont tout aussi drôles . a chaque épisode on se demande ce que cette formidable équipe va bien pouvoir faire pour nous faire plier de rire . a voir absolument .
0	chirurgie esthétique et pornographie pour une série sans intérêt . les histoires sont tordues , ne servent que de légére trame de fond a une succession de plans de fesses et d'images gore . si ça vous amuse ...
0	une série avec laquelle je n'ai pas réussit à accroché parce que les histoires se répétent et se ressemblent une lassitude s'installe malheureusement rapidement malgrés tout l'actrice principale jennifer garner interpréte à merveille son rôle .
1	une série inventive et ingénieuse qui porte haut les couleurs de la science-fiction . de saisons en saisons les épisodes et les différentes intrigues ne baissent aucunement en intensités ( c'est même assez rare pour être signalé ) et j'éprouve toujours autant de plaisir à suivre cette série que lorsque je l'ai découvert pour la première fois .
0	je ne sais pas trop .. série un peu débile .. du sang pour du sang , violence , etc ... ?
0	série insupportable et dégoulinante de morale , c'est de la torture !
0	la série ou mallaury nataf a connu son premier succès pour notre plus grande déception : à part johnny , qui restais assez marrant , quel est l'interet de cette série ? rien
0	les rebondissements apparaissent en quantité mais pas en qualité . le scénario est peu crédible . les acteurs surjouent ( francis huster en tête avec des effets de voix artificiels malvenus ) . toutes ces choses parasitent une histoire qui aurait pu être intéressante mais qui au final apparaît superficielle . dommage .
1	cool ! ! cette idée sur la police scientifique et non la police judiciaire comme la majorité des séries américaines est vraiment extra ! ! ! beaucoup de mystères , de suspense ... et d'attente de la part des spectateurs ! ! on attend la suite ! ! viiite ! ! ! félicitation pour l'idée de cette merveilleuse série , qui va , je l'espère vivre longtemps ! ! !
1	"je suis en train de regarder cette série , et je suis bluffé ! on "" entre "" dans le monde de prison break tout de suite ; on peut s'identifier au héros . les acteurs sont convaincants , le scénario est parfaitement réalisé . bref c'est la série de l'année , et même plus ."
0	trop pourri cette série a chaque fois que j'entends le générique sa me donne envie de vomir ! ! !
0	l'enfer de la famille américaine fantasmée . totalement puritain . totalement nul .
0	"concept de départ sympa avec scenario déjanté mais personnages trop caricaturaux à mon goût pour que cette série me plaise dans la durée . mention spéciale aux "" jambes "" de la femme d'aubrey et au fils de gracen qui restera une énigme pour moi et pour ses parents en n'en pas douter ;)"
0	"cette série était géniale au début . elle a su mêler humour et passion , mais en suite rien ... l'humour a disparu , les épisodes se suivent et se ressemblent . j'ai déalissé cette série pour "" ugly betty "" que je recommande à tous les fans déçus du "" destin de lisa "" ."
0	cette série est vraiment nulle ! il se passe toujours la même chose ! un tel qui meurt , un tel qui se sauve ! je ne sais pas si je ne comprends rien mais , pour moi , cette série est vraiment nulle .
0	voila une série totalement dénuée d'intêret qui compte uniquement sur le fait que l'actrice principale est moche pour plaire à un public féminin ( et ca marche ... ) . le coeur de la série david / lisa est inintéressant également . l'actrice principale qui est en réalité très jolie a donc bien réussi sa reconversion .
0	pas la peine d'avoir le brevet des collèges pour remarquer la cruelle débilité qui émane des scénariis catastrophiques . et avec un mouss diouf aussi crédible qu'un jacques chirac faisant du foot , julie lescaut soulève une certaine interrogation : on nous prendrait pas pour des cons des fois ?
1	tout simplement géniale la saison 1 d'heroes . les nombreux acteurs sont tous très attachants et même certains exceptionnelement attachants comme hiro nakamura . l'histoire est génial et contrairement à de nombreuses series comporte un fin . a regarder absolument en vo les voix francaises sont vraiments déplorables sans parler du générique . en résumé : série absoulument geniale
0	je n'ai pas pris la peine de regarder cette série ! elle recopie énormément les séries américaines tel que : nih d'où le nom qui ressemble énormément ! mais aussi ncis , new york unité spéciale ou encore les experts ! tf1 diffuse à chaque fois le même genre de série ! r . i . s c'est du déja vu !
1	y a pas mieux . j'ai été obligé de me relever pour continuer à regarder des épisodes .
1	c'est vraiment une série excellente . tout y est , suspense , intrigues ... tout simplement géniale . a voir absolument .
1	une série agréable pour toute la famille , et qui traite de sujets dont on peut discuter avec nos enfants .
0	sa tourne , sa retourne & sa re retourne autour du pot , la 1ere saison m'avait pourtant beaucoup plu , mais ensuite on s'en lasse a en mourir , c'est lent et c'est toujours la même chose , l'histoire n'avance pas . trés dommage , cette série aurait pu ètre grandiose mais non . - - seulement pour les grands fans - -
0	dieu que cette série est cucul . comme si tf1 voulait nous faire passer un message subliminal : il est 16h , vous feriez mieux de travailler plutôt que de vous abrutir devant des programmes niais et pleins de bons sentiments , avec un pasteur comme personnage principal .
1	tres tres bonne serie . je crois que beaucoup de jeune se sont indentifés a nos heros . une seire ou regnes une grande sensibilité , sensibilité accentué par des citation de grand auteurs tel que r . l stevenson ou encore tenesse williams .
0	je me demande si il existe pire que cette série , qui peut avoir l'idée d'inventer quelque chose d'aussi nul ! les acteurs sont très mauvais , les histoires sont banales et les gags qui sont censés nous faire rire nous donnent envie de changer de chaîne ... je me demande comment un tel projet a t'il pus voir le jour ?
1	j'adore cette série ! une vraie petite merveille , qui fait chaud au coeur ! cocorico , une série faite en france , avec peu de moyens , c'est vrai , mais des tonnes d'idées ! je me suis bien marré à regarder les dix premiers épisodes , et j'attends maintenant la suite avec impatience . eh , dites , les créateurs , c'est pour quand la deuxième saison ?
1	plus belle la vie est vraiment une série de qualité digne des plus grandes séries us . en effet tout est réussi , du casting aux décors , en passant par le scénario mêlant subtilement grandes enquêtes et petites scènes de vie du quotidien ! vivement une adaptation au cinéma !
0	série sans saveur sur toutes les situations familiales envisageables ( la présentation est d'ailleurs indigeste ) . tout est là , grace à une famille nombreuse . flockhart joue mal . les personnages sont stéréotypés , l'intrigue prévisible . aucune inventivité nulle part . sans être mauvaise , la série ne présente jamais d'intérêt réel .
0	une histoire de voisinage , de couples , de meurtre , ça fait un mélange bizarre ...
0	que du mauvais , rien qui puisse sauver ce bide sans interet .
1	franchement cest un monument de la serie comique-romantique je trouve que l'intrigue reste bien ficelée avec de nombreux rebondissements à voir et à revoir
0	ah ouf on a eu chaud ! mais qu'est-ce qu'on est fort nous les français : après les séries vieillottes et sans intérêt de 90 min genre julie lescaut , on a réussi à passer à la série vieillotte et sans intérêt de 52 min . vive tf1 ! c'est tellement vrai qu'on a rien à apprendre des américains en série tv . en attendant ce sont eux qui font les bonnes séries .
0	copié sur grey's anatomy . j'ai voulue regarder le premier épisode je trouve sa vraiment n'importe quoi je vois pas l'interêt d'avoir fait une série comme sa .
0	"24 repose sur un excellent principe et avait tout pour réussir . malheureusement , le "" temps réel "" donne lieu à un nombre vertigineux d'incohérences . les notions d'espace-temps en deviennent d'ailleurs inexistantes . seuls points positifs : visuellement , la série a un style , et kiefer sutherland est un excellent acteur . dommage pour lui qu'il soit enfermé dans cette série qui parfois frôle le ridicule ."
1	magnifique série , diablement réaliste , avec de bons acteurs ainsi qu'une excellente bo . félicitations à tout ce beau monde qui nous offre l'une des plus belle série télé sur la ww ii . rien à redire .
0	tout est mauvais dans cette série , et pourtant elle passe toujours et depuis plus d'une décennie . regardez un épisode en juillet et un autre l'année suivante à la même période , vous aurez l'impression d'avoir raté 20 minutes ...
0	voilà une pâle copie des experts , qui arrive un peu trop tard avec son scénario trop ... commun . le coté scientifique qui as fait la renommée des experts manque cruellement aux enquetes qui n'ont pas su bien remplacer cet interet . dommage .
