1	charmed est une série géniale . les actrices et acteurs sont formidables , c'est une série quasiment parfaite . malheureusement , je trouve qu'elle est en perte de vitesse : les scénarii commencent à se répéter , l'humour présent dans les premières saisons décline . cependant , c'est encore avec beaucoup de plaisir que je regarde charmed !
1	vraiment sympa , drôle , original , pas prétentieux , bien joué ... bref , enfin une série française novatrice .
1	vraiment sympa comme série ! ! ! pas très connue mais elle mérite le coup d'oeil ! ! !
1	cette série est la preuve que les français sont capables de produire du film télévision de grande qualité , contrairement à ce que leur production récente pourrait faire penser .
1	ma série préféré je l'a regarde tout les jours même si j'ai déjà vue certains épisodes , je trouve toujours cela aussi bon . encore une chose c'est drazic le meilleur .
1	de loin la meilleure série du moment . kiefer sutherland est toujours impeccable .
1	je trouve cette série très bien ! ! les personnages ont chacun une histoire qui leur est propre , ce ne sont pas tous des intellos qui ne parlent que de philosophie comme dans dawson ! ! en plus il y a le petit côté machiavélique de dan scott le père de nathan et lucas qui met du piment dans la série . conclusion : cette série est très bien et pleine de rebondissements ! !
0	une série bien lamentable à oublier très vite ! !
1	série très bien pensée ... tout concorde , très minutieux ... par contre , il y a pas mal de violence , donc ne convient pas forcément à un enfant de 10 à 12 ans , comme le laisse faire le csa . le cuop du tatouage avec le plan de la prison , c'est une super idée ! ! un grand bravo ! a ne pas louper dès le grand retour , bientôt !
1	une excellente serie rythmée par un suspense haletant ...
1	une série tout simplement exceptionnelle . au-delà des acteurs qui sont tous géniaux ( price ! ) , on nous fait découvrir l'univers des flics de ny d'une manière réaliste . ou qui nous le semble , et c'est le plus important . pas de tabous , les flics véreux sont là , les problèmes d'alcool , de drogue aussi . génial .
1	et oui encore un coup de maitre de la part des américains ! pourtant éniéme série qui relate de super héros mais celui-çi n'est pas comme tous les autres il sort du lot ne nous prend pas pour des débiles et est trés bien mené ! génial !
0	toxique pour les méninges ... à oublier vite !
1	je trouve cette série très prenante et intéressante . le fait de montrer à chaque épisode un nouveau 4400 nous incite à continuer à regarder . les personnages sont fouillés et suivre leur évolution est très agréable . mais , je trouve que la 2ème saison accuse une petite baisse de rythme c'est pourquoi je ne lui mets que 3 étoiles .
1	un appel à ceux qui ont décroché à cause des premiers épisodes faiblard et un peu raté , reprenez la suite ! c'est vraiment une grande série au final et je reste persuadé qu'on aura une suite un jour ou l'autre ... quand je pense que bionic woman , série infame et sans intérêt est renouvellé , et pas journeyman ! :(
0	nul . j'aimais au début cette série mais je ne la regarde même plus . très déçu .
1	c'est toute mon enfance c'est domage qu'on ne repasse pas ces vieilles séries on revoit bien de très vieux perry masson et les incoruptibles ,
1	c'est une série au top ... pleine de suspense ... dès qu'on voit les premiers épisodes on a envie de voir les suivants ... on a pas envie que ça s'arrete ... c'est comme une drogue ... vite la saison ii
1	que dire ? fabuleux acteurs , excellents scénarii , musiques originales ... haletant , palpitant ... on devient vite dépendant de cette série , certainement la meilleure de tous les temps .
0	ridicule ... décidément les gens sont attirés par des séries bidons qui sont sans intelligence et sans humour . celà ressemble franchement à ce que les américains nous filent comme les soi-disant tv reality shows . un dallas version année 2000 . plat , pas marrant , 4 chômeuses du dimanche qui ont trouvé un job . tentative de copier friends ?
1	cette série a un humour vraiment très très bête , mais on rigole , il faut bien l'avouer . les situations sont absurdes et les personnages à la limite de la débilité profonde et donc on ne s'ennuie jamais .
1	c'est la meilleure série de tous les temps , en plus les actrices jouent très bien leurs rôles et il y a des actions trop mordantes ! on rit et on pleure . c'est ça la belle vie .
0	"cette presque adapatation française des "" feux de l'amour "" est aussi ridicule que "" les feux de l'amour "" ... est ce que "" plus belle la vie "" vas durée 30 aussi ... ? ?"
1	je suis totalement accro ! je suis complètement sous le charme des personnages , des situations drôles ou très tristes ( 2.06 remarquable ) et c'est cela qui fait de grey's anatomy une de mes séries préférées !
0	"j'aurais du apprécier car suis un gros vrai fan de "" my name is earl "" et y'a du commun entre ces deux séries . pourtant , j'ai jamais pu accrocher . si les personnages sont également loufoques et cons à aimer la starac , ils sont moins attachants et leurs dialogues sont moins léchés ."
1	c'est super parce que c'est la première série actuelle qui se passe dans un collège , en plus ça ressemble vraiment à ce qui se passe là-bas du style : les bouffons , les caïds ... en plus les acteurs sont bien choisis et les scénarios aussi !
1	"excellent comme série , c'est vraiment trés bien , sa retransmet bien le mythe de superman , mais je pense que smallville ( dont je sui le plus grand fan ) sera plus dans la légende que lois et clark les nouvelles aventures de superman "" mais c'est vraiment trés bien aussi , a regarder"
1	très très fun ! a voir !
1	c'est la meilleure série que je n'ai jamais regarder ! cela fait deux ans que j'écoute ça , la première et la deuxième saison et je trouve ça incroyable ... je me reconnais vraiment dans cette série et des fois j'ai l'impression de vivre leurs problèmes ... je rentre vraiment dans l'histoire ! malade !
1	cette série est vraiment formidable . pour ma part elle m'a fait découvrir énormément et je ne me lasse pas de la regarder jour après jour . je les adores tous ce sont vraiment des acteurs qui tiennent bien leur role .
1	dès le premier épisode l'univers de prison break m'a envahi , le scénario est juste incroyable , le casting extraordinaire ... j'attends la saison 2 avec impatience en espérant qu'elle soit aussi royale que la première .
0	j'avais flashé sur les premiers épisodes de la série . puis j'ai constaté que les situations étaient de plus en plus exagerées , les idées poussées au-delà de la crédibilité , bref , j'ai rapidement déchanté à partir du 3ème épisode ... les personnages sont trop stéréotypés et prévisibles , le côté psychologique est décevant . bref , une riche idée pour cette série pauvre ...
1	un manga génial , nicky larson et l'un des meilleurs manga qui existe avec une tres bonne histoire , mais bon la version fr comme pour pas mal de manga et fraiment naze avec toutes les censures .
0	une maniaque coincée ... une grande niaise débile et fleur bleue ... deux bimbos antipathiques ... clichés et ragots prises de tête à foison . il y aurait bien la mère dépassée que j'apprécie car plus proche de la réalité selon moi , mais malheureusement , ni elle , ni certains personnages masculins n'arrivent à faire remonter la série dans mon estime .
1	je suis accro ! j'aime trop , je ne saurais pas dire pourquoi , mais je n'ai qu'une hâte c'est voir à chaque fois un autre épisode ! c'est trop bien !
1	une pléiade d'acteurs talentueux ( dominic monaghan , ian somerhalder , naveen andrews , maggie grace , josh holloway , daniel dae kim , yoon-jin kim ... ) et une histoire qui permet à chacun d'interprêter à sa façon la symbolique de l'île . mais au fil des épisodes j'ai commencé à m'ennuyer et à trouver les scénarios moins intéressants et moins intelligents . en espérant que la seconde saison sera mieux que la fin de la première ...
1	ah ca fait zizir de voir une série si excellente , dés la premiére scéne , on sent que c'est du lourd , et là on lache plus . la saison 1 est terrible , j'espére que la saison 2 sera au moins du meme calibre .
1	las vegas rien que le nom de cette série donne l'eau à la bouche . les acteurs sont bons et les dialogues bien écrits . merci de nous faire autre chose que des séries policière ou fantastique .
0	sans intérêt de se plonger dans ce navet où les acteurs manquent cruellement de vérité dans leur jeu .
0	moi je trouve que lost est bien mais reste simple et copié , je ne trouve pas que cette série est fait preuve d'originalité et de creation , c'est juste un assemblage de plusieur série tout simplement . de plus , les acteurs ne sont pas convaincants , ils n'y a pas de grand talent dans la maniére d'interpréter et aucune émotions est ressentis dans cette série .
0	nul ... pourtant j'ai essayé de regarder plusieurs épisodes mais je n'y arrive pas ... cette série confirme que les séries allemandes sont en général très niaises ... le jeu des acteurs est navrant ... enfin bon , nul ! ! !
1	j'adore cette série que je regarde sur comedie ! je l'avais déjà vue lors de sa première diffusion en 85 sur antenne 2 ( france 2 ) , c'est une série romantique , drôle , où les personnages sont magnifiquement interprétés par kate jackson et bruce boxleitner.on s'identifie facilement à cette mère de famille qui rencontre un espion plein de charme .
0	sans intérêt car trééés ennuyeux . pas vraiment d'action , beaucoup de clichés . les actrices et acteurs surjouent . décevant !
0	une série à voir quand on est déprimé ( comme je le suis souvent ) et qu'on a la flemme de se mettre un bon film ou d'aller au ciné . dans ce cas on pourra apprécier les gigantesques problèmes de coeur de cette pauvre pdg sur laquelle tous les malheurs s'accumulent . sinon , je vous préviens que c'est assez dur .
1	je pense que c'est le genre de série que j'adorerais en étant célibataire ... mais je l'adore aussi quand je le suis pas ! how i met your mother est franchement divertissant entre des épisodes de lost , jericho ou heroes . détendre son cerveau , c'est important aussi et , après vision de la 1ère saison , mon constat est sans appel : how i met your mother est simplement legendary ! ! !
0	une série française qui se veut américaine dans son scénario . cette série ne vaut vraiment pas le coup . surtout avec ses acteurs qui surjouent pendant toutes leurs scènes .
1	série envoûtante par le suspense qui donne envie de connaître le déroulement de chaque épisode . très bons jeux des acteurs et très bon scénario dans un décor plutôt inhabituel . j'adore . bravo ! bel acteur principal .
1	cette série est pur bonheur a chaque fois , du suspense en veux tu en voilà . les acteurs sont excellents
1	magnifique serie , je suis devenu un grand fan . cette serie est un melange de x men , smallville et les 4400 , c'est vraiment une serie geniale , dommage que les francais n'aiment pas :(
0	je savais que les séries françaises valaient pas grand chose mais là on est vraiment tombés bas ! cette série est nullisime ( c'est mon avis ) , le jeu des acteurs laissent vraiment à désirer , les scénarios changent pas : c'est toujours un nouvel arrivant à marseille et un meurtre ... bref un mélange de tous les ( mauvais ) soap opéras qu'on a pu trouver . ca se laisse même pas regarder tellement c'est insipide !
0	dommage que l'on ne puisse pas mettre des moins 2 étoiles car cette série est vraiment trop nulle . les acteurs sont convaincants comme des tortues de mer , l'histoire ... elle me rappelle une série espagnole ... trop nulle , zappez de suite cette série !
1	superbe série avec des acteurs et des environnements impressionnant et crédible . une série à recommander à tout le monde .
0	dans cette série tout sonne faux , les acteurs surjouent des dialogues qui n'ont lieu d'exister . de plus , le scènario est digne d'un remake des feux de l'amour , c'est une série qui sera oublié aussitôt qu'elle sera arretée . je passe tout de suite ..
0	c'est la serie la plus ridicule jamais paru au monde . intrigue affligeante et toute plus copié les une sur les autres , des histoire qui ne tienne pas debout , des acteur ridicule dans des decor consternant , un eclairage minable , des suspence toujours identique ... une honte .
1	je n'ai jamais été aussi stressé en regardant la télé , c'est incroyable , le coeur bat à fond presque tout le temps , c'est de la folie . je conseille cette série , à ne manquer sous aucun prétexte . c'est tout simplement fou . les acteurs sont trop marrants et attachants .
1	sans aucun doute la meilleure série diffusée à ce jour . les personnages et l'histoire sont tellement cons que ca en devient jouissif ... je déconseille fortement ce chef-d'oeuvre télévisuel aux jeunes de moins de 16 ans sous peine de finir drogué , alcoolique , terroriste ou prostitué . j'aime cette série ! ! !
0	serie trop violente a mon gout
0	une série spécialement créée pour les beaufs et les personnes incultes qui ne suivent que les séries ultra médiatisées , un vrai phénomène de société .
1	super ! !
0	quelle crise de four rire en voyant cette série . je crois sincèrement qu'on peut lui décerner le prix de la sitcom de l'année ... immonde et niaise , caricaturale et stupide , heureusement qu'elle a été annulée ...
0	je peux pas le nier , j'ai regardé les premières saisons de cette série étant plus jeune , mais très franchement on s'en lasse très vite , c'est toujours la même chose , les mêmes problèmes ... bref ça devient gnangnan à la fin !
1	alors là , wahou ! j'ai été bluffé par cette série . la réalisation est rythmée , les acteurs sont tous crédibles , on est en stress pendant 42min par épisode ! a voir absolument , en vo bien sûr .
0	une série médicale de plus , avec tout ce que cela suppose de clichés ! je n'ai pas du tout accroché , ça m'a saoulée d'emblée !
0	j'ai regardé un épisode et j'ai craqué ^ ^
0	j'en ai entendu parler mais franchement c'est chiant ça bouge et on sait déjà la fin . j'ai regardé et ça se voit que c'est pas ricain car c'est pourri .
0	j'ai été vraiment déçue par cette saga . les situations invraisemblables et la non-crédibilité des acteurs me faisaient croire à une parodie . c'est vraiment dommage de faire évoluer les séries d'été de cette manière .
1	la série du moment qui nous fait devenir accro au petit écran . tout dans cette série est fait pour attiser la curiosité du téléspectateur , tout d'abord les mystères , nombreux , de l'île ensuite le passé , parfois tumultueux , des rescapés et surtout leurs vies ( et parfois leurs morts ) sur l'île . tout cela fait de cette série l'une des meilleures de toute l'histoire de la télé .
1	une série qui brille par sa complexité , il n'y pas de bons ou de méchants selon moi , mais des personnalités complexes motivées par des buts différents . cela donne lieu à des situations elles aussi passionnantes . en plus de cela , l'univers et les enjeux développés renforcent encore son intérêt .
0	série très ennuyante , rien à voir avec lost du tout ! les acteurs jouent mal pour la plupart , les histoires sont déjà vues . bref , je me suis arrêté au 1.09 car vraiment aucun intérêt de suivre cette vieille série aux effets spéciaux ridicules ( quand l'école prend feu , c'est super mal fait ) ...
1	un mot , excelent
1	cette série est vraiment géniale : elle est novatrice car elle met en scène plusieurs personnages principaux qui doivent faire face a des évènements quelque peu étranges et inquiétants ... que de mystères avec cette série qui nous fait réfléchir et nous hante après chaque épisode ! ! a ne pas rater sous aucun prétextes ! ! !
0	arabesque me fait penser en version femme à monk . un peu le même style d'enquetes , mais en plus vieux et moins j'ai moins accroché . je vous conseille donc plutot monk .
1	une très bonne surprise ! la série est l'experte du divertissement ! mélange de suspense , complots , action , violence ( légère quand même ) , romance , bref tous les ingrédients sont réunis pour que chaque épisode soit intense et que l'on ne s'ennuie pas une seconde ! une série à découvrir d'urgence !
1	kyle xy est vraiment une série intéressante car elle mélange une trame de fond où le héros recherche qui il est et des histoires plus terre-à - terre : amitié , amour ... l'originalité réside dans le fait que kyle a une vision totalement naïve du monde . le duo qu'il forme avec josh trager est très drôle . une série qui j'espère nous réserve encore plein de surprises !
1	série culte par exellence ! sam et al deux personnages inseparable et si touchant par leur nature , l'un est tres pausé l'autre tres exentrique ! cette série nous donne une morale à chaque épisode et nous fait bien réflechir sur beaucoup de sujets !
1	awesome ! pour les fans de friends et scrubs , himym est vraiment la référence actuelle tellement cette série est géniale . les personnages sont délirants voire legendary ! le scénario toujours à rebondissements , les gaffes de ted toujours aussi nombreuses et que dire de la très jolie robin ! alors , have you met ted ?
0	cette série à déjà un handicap ! elle est française ! mais là c'est vraiment pitoyable ! des acteurs , des décors , et un scénario bas de gamme nous emmènent dans un ennui interminable !
0	une serie sur les profilers vraiment bas de gamme . tous les ingredients du navet y passent : psychologie de bazar , histoires sans interet , personnages fades et morale americaine omnipresente
1	super série ! vraiment un régal , du suspense tout ce qu'il faut pour passer un bon moment . dans le genre 24h sans vraiment l'égaler ...
0	""" voici une série drôle "" nous avait annoncé m6 pour la première de malcolm . en fait , c'était de la publicité mensongère ! le personnage principal est lourd et les scénariste ont du mal à le rendre drôle . les gags sont puériles , vus , vus et revus . seuls reese et dewey dans les saisons 4,5 et 6 relèvent un peu le niveau de cette série morbide ."
0	dans une musique motivante , le matin y'a de quoi vouloir se rendormir devant une serie qui n'a ni queue ni tête et pour finir , il se passe toujours les mêmes choses . ce que je ne comprends pas , c'est comment la série réussit à avoir de l'audimat ... surement que les gens doivent dormir devant la télé pendant que ça passe ... qui sais ...
1	c'est ma série préférée du moment , enfin plutôt c'était parce que maintenant ça commence un peu à partir dans le n'importe quoi . pas étonnant quand on lit que les scénaristes eux mêmes ne savent pas où ils vont ... mais bon l'histoire est assez bien menée et les persos sont attachants et puis il y a tellement de suspense , on ne sait pas à quoi s'attendre , c'est d'ailleurs parfois un peu trop poussé ..
0	j'ai regardé la premiere saison de prison break avec peine.je trouve que cette serie ne presente aucun intéret . elle n'est qu'une suite d'événements abracadabrants , aucune surprise tout est previsible , quand on a vu un episode on les as vus tous tellement ils sont lineaires.je n'ai pas non plus reussi à m'attacher aux personnages.bref c'est une serie froide et molle comme il y en a peu .
0	j'ai attendu 7 épisodes pour laisser à cette série sa chance , mais rien n'y fait . je m'ennuie à mourir , tellement , c'est soporifique . pourtant , les début étaient plus ou moins prometteurs , malgré cette music de fond à chaque ralenti ou prouesse physique , ridicule à notre époque . je ne comprend pas .
0	série qui se veut peut-être provocante mais qui n'est que vulgaire , scabreuse , tordue et sale ! ! ! tout est prétexte à coucheries et goujateries . les personnages sont aussi immondes les uns que les autres . lamentable ! zéro pointé ! ! !
1	"un soir j'ai vue un esprie . il ma dit "" tu vas ﻿ mourir "" est il a disparue . maintenant que vous avez lu sa vous aller mourir dans 3 jours exactement sauf si vous mettez sa sur 50 video , c'est pas de moi"
1	newport beach , c'est une série typiquement américaine , un tentinet pathétique mais qu'on regarde avec bcp de plaisir malgrés tout . j'adore les séries comme ça , c'est vraiment un cliché , mais j'adore . de plus ça me plait que pour une fois il y ai une série super qui ne passe pas sur tf1 . le seul problème de cette série : un peu trop prévisible , mais bon , on adore tellement ça ...
0	sorai pu etre bien pouvez vous me dire pourkoi il y avai ok1 black dans cette série pourkoi dans les série française il ny a jamai de black donc pour moi rien ka cause de sa kon ne laisse pas toute les personne de tou lé milieu surtou en france pas pouvoir jouer dans lé série francaise voila pourkoi lé série francaise son archi nul pfff vive la france multicolor é ouai gros 2008
1	je préfère de loin cette série à zodiaque et dolmen , elle est plus réaliste ! elle était passée il y a 3 ans et elle est repassée cette année dans l'après-midi , je me suis régalé à chaque épisode .
1	tout simplement la seule série dont le suspense m'a amené à trembler pendant 40 minutes devant mon écran ... au sens propre .
0	vraiment très bof ... j'aime pas du tout ... c'est censé être réaliste , mais les dialogues où ils analysent tout sont vraiment ridicules ... et puis bon c'est mou quoi ! cela tourne en rond ...
1	qu'elle idée merveilleuse cette série ! ! et surtout d'avoir intégré mr hugh laurie , vraiment un très grand acteur ! ! comme tout le monde se plaît à le dire ! : on aime le détesté !
0	la série de beaufs , mais de beaufs américains ! insipide et sans intérêt . pour les espaces vides ( je parle des individus de 4 ans et + ) présent devant leur poste !
0	je viens de découvrir cette série et je n'ai pas aimé du tout . l'histoire n'est pas du tout originale et les acteurs jouent très mal leurs rôles respectifs . bref , point pleasant m'a déçu !
1	cette mini-série à bien remplit ses fonctions ... celles de nous faire rire et celle de nous attendrir . je lui en veux juste de s'être terminer beaucoup trop tôt :( .
1	tout simplement mon manga / anime préféré ! tout y est : humour , angoisse , rires , pleurs , perso géniaux , dessins sublimes , scénario grandiose ! ! ! la fin est peut-être un peu trop triste et le film en dessous de mes espérances ... mais sinon c'est geniallleuuuhhh
0	il m'est arrivé de sourire en regardant kaamelott mais je dois bien avouer que c'est assez rare . les épisodes sont très inégaux , et puis il faut bien avouer que le ressort humoristique de l'anachronisme est surexploité , c'est un peu lourd . dommage ... j'ai l'impression que l'idée de kaamelott a été largement inspirée par sacré graal des monty python . eh bien je préfère l'original et de loin ...
0	cette série est tout simplement démente , je me suis tordu de rire tout au long de la saison un . les personnages sont attachants , l'humour est vif et new yorkais . une série dans le genre de friends avec moins de perso , plus d'amour , plus d'humour et encore mieux ! à ne pas rater !
0	cette série et vraiment grotesque , les dialogues sont nazes , la réalisaton nulle , le jeu des acteurs mauvais .
0	très moyen cette nouvelle série . même si c'est un peu original on s'ennuie vite . j'ai regardé le premier épisode puis le 2e j'ai arrêté au bout de 15 minutes . les intrigues sont biens mais un peu mou . trop de dialogue manque un peu d'action
0	je me demande comment cette série a autant de succès tant elle est débilissime ( gags d'une lourdeur affligeante , cabotinage et j'en passe ) . cette série est pour moi la preuve absolue que les américains ne sont pas doués pour les comédies .
1	j'ai adoré cette série , drôle , pétillante . jean dujardin est parfait en macho légèrement beauf , et alexandra lamy très rogolote en chiante . c'est parfois volontairement exagéré et caricatural et tant mieux !
0	ridicule ... j'ai pas grand chose a ajouter sur ce qui a été déjà dit . sa m'étonne quand même autant de bonne critique pour une série aussi mauvaise . 0 étoile sans hésitation !
1	un pur régal ! en mélangant comique de mot , de situation , de gestes ... et grâce à un éventail d'acteurs plus que talentueux , les friends nous font rire aux larmes sans pour autant sombrer dans le grotesque . un cocktail d'humour délicieusement léger !
0	c'est franchement dommage de voir une série française aussi pitoyable ! non seulement le scénario est nul mais en plus il y a très peu d'action . je ne parle même pas des acteurs ... on a l'impression qu'ils se forcent à s'exprimer comme des jeunes sauf que ça ne va pas du tout ! j'ai essayé d'accrocher mais c'est d'un tel ennui que j'ai zappé .
1	dommage que cette serie soit finie . elle etait tres sympa a regarder , avec des personnages tres interessants et diversifiés . de bons acteurs , de bons scénarios .. je n'ai rien a redire sur cette serie ! !
1	jamais une série n'aura plongé le spectateur aussi près du crime ! chaque seconde de la série est un délice et on se prend au jeu à chaque épisode . l'équipe d'acteurs est évidemment très bien choisie et rend les scènes d'investigation plus vraies que nature . une série incontournable tout simplement !
1	c'est vraiment une bonne serie j'adore dommage qu'elle ne soit diffusée que sur europe 2 ou fillestv !
