0	nul nul nul ! c'est vu et revu et la série manque totalement de profondeur , de charisme . le ton est surjoué au lieu d'être décalé , avec un vague rappel des deschiens en moins bien . ils croient se moquer du ringard , mais restent ringards à 100 % . je regrette que cette série soit diffusée tous les jours et j'attends avec impatience un renouveau de qualité ! please !
1	tres bonne serie pour les amateurs d'action , humour et suspence.de plus les acteurs jouent vraiment tres bien.une serie culte .
1	la première saison était géniale , la 2e était pas mal , la 3e est bof ... messieurs les scénaristes , trouvez des idées pour relever un peu la série sinon on va finir par s'ennuyer ferme !
1	une série à la fois policière , comique et tendre ! cette série est à voir !
0	avec la politique des séries chez m6 , on se retrouve avec du ncis en permanence jusqu'a en dégouter des personnes qui aimait bien avant . perso j'ai beaucoup aimé au début mais là overdose , j'en peux plus de voir ncis en permanence sur m6 , à croire qu'ils n'ont que cette série . il y'a un an j'aurais sûrement mis trois étoiles à cette série mais là , non .
0	ha ha ha ! si jamais les américains tombe sur cette série , ils vont se foutre de notre gueule pendant un moment . histoire nul , acteurs ridicules ...
1	cette série est incroyable ! ! ! on y devient très très vite accro : scénario excellent , jeu des acteurs très bon ! ! ! à voir d'urgence !
1	cette série est vraiment prenante ! dommage qu'elle ne soit d'avantage connue en france et que la première saison ne soit vendue uniquement qu'en anglais .
1	cette serie est trop geniale franchement , j'avais deja vus certains episodes sur canal + mais rien ne m'empeche de les re regarder ... cette serie je l'adore
1	c'est un vrai régal de suivre les aventures de cette famille où l'amour et l'humour règnent ! nos enfants regardent avec nous et sont autant ravies que leurs parents ! alors s'il-vous-plaît , on attend la suite avec impatience ! !
0	on prend les mêmes ingredients et on recommence ! un mort , une enquete , des expertises d'indices ( ici des os ) et on trouve le coupable ... fin de l'episode . dans la lignée des experts et cie , vraiment aucune originalité , c'est ennuyeux à mourrir ces series là ...
0	pour un bouffeur de curé et vomissant les bons sentiments , cette serie est imbuvable .. on dira poliment que je ne suis pas dans la cible ..
1	sans doute la version des experts . les deux autres ne sont pas a la hauteur
0	j'ai recemment revu deux episodes sur nrj ... mais c'est inimitablement navrant de voir ca , & de me rappeller que j'aimais bien regarder quand j'avais 10 ans ...
0	il était ambitieux et surtout prétentieux de vouloir copier une série américaine telle que ny .. résultat lamentable ! même ris semble palpitant à côté .. c'est surjoué , sans surprise . bien français quoi ! lol
1	je n'avais jamais regardé de series ricaine avant lost , mais là je suis rester scotché saison 1,2 , 3 tous est genial , les persos , l'histoire , les décors ! bravo
0	ca commence comme du x-files et ça vire au buffy de bas étages ... a voir pour une première saison interessante , c'est tout . la seconde montre déjà de gros signe de faiblesses , ne tenant la route que 6 épisodes . après ça devient carrément chiant . une bonne idée qui devient un résultat toujours plus décevant à chaque épisode . dommage .
0	"je suis vraiment étonnée que cette "" série "" puisse avoir 3 étoiles de moyenne ... de mauvais acteurs , pas d'histoire , des dialogues navrants ... je n'arrive pas à comprendre qu'on puisse regarder un truc pareil !"
0	une serie debile pr debile ! ! !
1	excellent série que l'on suit avec énormément de plaisir .
0	série propagande avec messages politique pro-bush à la clé , c'est tout ce que laisse présager cette série dénuée d'intérêt .
0	je ne vois vraiment pas pourquoi cette série existe depuis plus de 30 ans ... toujours les mêmes histoires , toujours la même fin , le gentil flic gagne sur les méchants et malgré les morts de l'épisode , tout le monde il est content , youpi ...
0	en tant que policier , ce film m'a fait mourir de rire ! le jour où l'institution ressemblera à cette fiction , il y aura du souci à se faire ! je l'ai regardé sous la forme d'une comédie , bien que la scène où l'individu violent tabasse sa femme ne cadre pas avec le reste .
0	"une série qui remplace bien "" benny hill "" , "" la classe "" , ou encore "" c'est mon choix "" , programmés sur le même créneau . c'est navrant , pauvre france !"
1	très bonne serie policière pour l'époque . la b . o etais bonne ainsi que le duo qui allaient bien ensemble . bonne serie des années 80 .
1	"un soir j'ai vue un esprie . il ma dit "" tu vas ﻿ mourir "" est il a disparue . maintenant que vous avez lu sa vous aller mourir dans 3 jours exactement sauf si vous mettez sa sur 50 video , c'est pas de moi"
1	excitant ! c'est le mot qui vient tout de suite à l'esprit en pensant à cette série que j'ai découvert par hasard . chaque épisode est un concentré de suspense et de rebondissements . les acteurs sont très convaincants et l'histoire , bien qu'à priori banale , est bien plus fouillée qu'elle n'en à l'air . en bref , excellent , j'attends avec impatience les saisons à venir !
0	les acteurs sont tellement mauvais , qu'il m'est impossible de voir un épisode en entier . et dire que c'est la série française qui marche le mieux ( je ne parle pas bien sûr des soi disant séries comme julie lescault , qui en fait , n'en sont pas ! ) , moi , je trouve ça navrant !
0	voila un remake de beverly hills remis au gout du jour . les histoires de famille américaine , ca date de dallas ... a eviter .
0	serie qui merite a na pas etre connu encore un pseudo amour avec des acter horible
0	une entrée en fanfare avec une superbe saison 1 ... mais alors quelle décrépitude depuis ... c'est très très dommage !
0	aucune étoile pour cette série . elle ne m'a jamais fait rire . en un mot : pathétique !
0	"que de niaiseries ... que de puritanisme ... en fait cette série incarne l'amérique que l'on n'aime pas beaucoup de ce côté de l'atlantique . celle pour qui coucher avant le mariage est un péché et pour qui tout acte de l'adolescent doit forcément être accepté voir même entraîné par ses "" braves "" parents . pour rester dans l'esprit manichéen de 7 à la maison je dirais donc "" c'est mal "" !"
0	encore aujourd'hui c'est diffusé sur deux ou trois chaines française . donc comme moi et d'autre meme si ont s'en fous ont tombent dessus.je dirais que c'est les filles d'a coté à la sauce américaine . car c'est pas une série mais un dechet de sitcom ( tournage en studio et rire enregistré ... etc ) . c'est tout de meme un peu mieux , ça ce regarde mais sans plus .
0	"ah enfin , j'ai regardé "" lost "" la série culte ... et je n'ai tenu que 5 épisodes ! l'épisode pilote m'a vaguement intéressée à cause de la nouveauté et ensuite plus rien ! cette série est carrément mauvaise , les personnages sont stéréotypés au maximum et l'histoire ... mais c'est le néant total ! a éviter ."
0	si je met une étoile , c'est vraiment pour les 2 premiers épisodes que j'ai aimé , sinon ça vaut zéro à mon humble avis ... quitte à regarder le combat du bien contre le mal , autant regarder buffy ... c'est pas très constructif comme critique , mais c'est juste mon avis !
0	je peux pas m'encadrer cette serie , le cousin carlton m'insupporte , l'ambiance m'insupporte et meme parfois will smith arrivait a m'insupportait , mais bon c'est will smith alors 1 etoile ..
1	au départ pas grand chose à reprocher à cette série mais déjà à la fin de la première saison on s'était un léger manque de rythme dans la trame principale , j'espère que les scénariste nous prépare quelque chose de plus développer pour la suite .
1	série totalement inegalée . son second degré et ses scénarii déjantés en font un monument incontournable dans l'univers stéréotypé des séries comiques .
1	géant ! tout simplement une des meilleures séries à suspense que j'ai jamais vues ! on est tenu en haleine dès le premier épisode , on se sent proche des personnages et ressentons leur rage , bonheur ... un bon moment en compagnie de michael scofield and co ! espérons juste que les saisons suivantes seront à la hauteur de la première ...
0	une série policière française parmi tant d'autres . le jeu des acteurs est passable , sauf bruno wolkowitch qui n'était vraiment pas crédible dans l'épisode que j'ai vu ( délices de chine ) . j'attribue une étoile pour la qualité des scénarii , mais pas plus pour la lenteur des histoires . bref , une série à regarder en dernier recours ...
0	il devienne enfin realiste et arrete cette serie stupide .. tant mieux a la place on a ncis et sa c'est vraiment de la serie pas comme cette pourriture qui gache nos soirée ^ ^ 5quoi j'en fait trop meuuu non )
0	"voilà encore autre chose ... c ' est pas "" femmes de footballeurs "" que ça devrait s ' appeler mais "" femmes de mafiosi "" , cette série est ridicule : la vie de sportifs professionnels n'est pas aussi débauchée , là ils passent tous pour des machos volages et sans cervelle ."
0	nunuche a souhait 2 épisodes m'ont suffit pour m'en dégouter à jamais ...
1	j'adore cette série originale et captivante . des acteurs tellement vrais et des histoires qui nous tiennent en haleine jusqu'à la dernière seconde de l'épisode . j'attend la deuxième saison que je ne louperais pas ! ! longue continuation à cette série !
1	ceux qui disent que c'est une série bouche trou de m6 sont des mauvaises langues . alors dans ce cas pourquoi depuis plus de dix ans personne ne s'en lasse . le début de cette série est magnifique , la fin peut-être un peu moins . superbe série pourtant avec aucune prétention .
0	je n'aime pas du tout , j'ai pourtant essayé plusieurs fois mais je n'arrive pas . je la trouve beaucoup trop formatée à la sauce américaine .
1	deperate housewives , depuis son apparition à m6 avec ma mère on se farcit tous les épisodes . c'est excellent , à tel point que manquer un épisode c'est oublier de mettre de l'essence dans sa voiture : ça marche pas . on regarde ensuite tous les autres épisodes ( on se sent obligés on ne sait trop pourquoi ) . en tout cas j'attend vivement le passage de la saison 2 sur m6 !
1	"que dire ? cette série est tout simplement culte et je ne m'en lasse pas ... je l'ai vue et revue mais je ne peux pas m'empêcher de la regarder à chaque fois . "" ce vieux jr "" est particulièrement génial !"
1	j'ai connu cette série à sa première diffusion sur m6 . la rédécouvrir pendant sa rediffusion ces dernières semaines était un réél plaisir . cette série est très touchante par ses situations réalistes . certains épisodes sont très émouvants . de plus , l'interprétation est parfaite . chaque personnage a un rôle bien ancré dans l'histoire . enfin le petit plus de cette série est le générique que je trouve tout simplement magnifique !
1	très bonne série mais trop de chauses inexplicables qui s'accumulent . sinon les acteurs jouent très très bien et le décors est sublime .
1	j'aime beaucoup cette série car contrairement aux apparences , elle n'est pas simpliste . il y a le gentil jarod , les méchants du centre et ceux dont on ne sait pas si on peut se fier : mlle parker , sydney et broots ... ca passe le temps les jours de pluie !
0	dommage qu'on ne puisse pas mettre moin 5 étoiles parce que la vraiment on ateint le summum de la banalité et du manque d'originalité mais le pire c'est le nombre de commentaire 4 étoiles 370 contre 20 pour 0 étoiles :\ a réservé aux plus jeunes et encore ... c'est un peu l'helene et les garcon du 21eme siecles .
1	une série intelligente avant tout réservé au fan de science-fiction . les épisodes sont vraiment bons et passionnants , la psychologie des personnages est très bien développée , les acteurs sont talentueux , le suspense ne baisse pas en intensité , non une vraie bonne série qui pour moi se révèle bien meilleure que heroes .
0	série évènement ? ? ? des épiosodes longs et ennuyeux et des acteurs pas crédibles , aprés cinq épisodes à n'avoir rien de mieux à regarder à la télé le samedi soir j'aie preférée aller me louer un dvd . m6 m'avait habituée à mieux , prison break , supernatural ...
1	"tout simplement géniale . lorsque le dvd commence , on rentre ( comme qui dirait ) dans le vif du sujet . on se demande vite s'il y a une histoire profonde là-dedans , et après quelques minutes on s'attache aux personnages . une série sur le "" monde "" lesbien plutôt bien ficelée sans être "" trash "" . je finirais juste en disant ceci : excellent ! !"
1	série géniale ! du drame , du rire ( grâce à des personnage comme carlos ou bien entendu bosco ) et surtout de l'action ! ces ingrédients font de cette série la meilleure du genre ... pour moi !
0	"cette série ou les héros ont tous l'air de sortir d ' "" hec "" est lisse , totalement insipide sinon simplement débile !"
1	trés bonne série , à la fois drôle et intelligemment faite .
0	c'est du lourd attention la série événement ! ! ! m6 se moquerait t-il de nous ? ? ? cette série est encore plus soporifique que derek . pas d'action , pas de suspens et une intrigue à faire pâlir hollywood tout entier . bref , espérons que la saison 2 soit à la hauteur de mes espérances mais c'est mal partit ...
1	série rebondissante en émotions ! un casting d'acteurs totalement différents ethniquement et le résultat est tout simplement surprenant et fabuleux !
1	je n ai vu que les épisodes 12 . 15 . 16 de la saison 3 j ai n ai que une hate ce que sa passe sur tf1 pour voir les episode entiers mes perso prefères : claire desmont et jack
1	cette série est un véritable chef d'oeuvre du petit écran ! jessica alba y est très convaincante , michael weatherly égalemnt et jensen ackles ravissant en garçon tourmenté ! dommage que seulment deux saisons aient été tournées ...
1	une série sans prétention , avec un humour certes un peu lourd par moment mais qui nous permet 20 minutes de vrai bonheur . tous les personnages sont loufoques mais tous complémentaires l'une des seules séries actuelles qui me fait plus que sourire
0	"sans déconner ... 4 étoiles ! ! ! qu'est ce que les gens trouve à cette série , c'est ultra bête , très très très mais vraiment très très mal joué les 2 "" actrices "" sont aussi charismatique qu'un bouchon de shampoing , pire même .. du coup on préfère presque regarder walker texas ranger car à coté des 2 greluche de missing chuck norris est un grand acteur .."
1	une serie vraiment geniale
1	j'ai beaucoup aimé les 3 premiers épisodes de cette série , et je trouve bien qu'il n'y en ai que 6 ... au moins c'est clair , net et précis ! on est sûr de ne pas partir sur des bases à la 4400 !
1	c vrémen une série pa comme les otre c pour ca qu'j'lador un plus presque tou les acteur sont mignon et ca c un bonus
0	franchement , moi je dis pauvre france ... je savais que déjà le cinéma français était en chute libre , mais de là à ce qu'ils fassent du copier / collé sur les séries américaines ... les français n'ont plus d'imagination et doivent donc imiter les choses faites par les américains qui ont du succès . pathétique .
1	super serie ! ranchement rien a dire la dessus ! vivement la saison 2 :) visitez : http://alex2212.miniville.fr/ind
0	je trouve cette série géniale on se met facilement dans la peau des personnages on recent bien les émotions bref j'ador cette série . vivement la saison 2 . ju
1	cette série est géniale je me suis acheté toutes les saisons en dvd personnellement c'est la stimulation de l'adrénaline qui me plait
0	je n'aime pas du tout cette série car je trouve que c'est très mou . l'intrigue est vraiment décevante et alain delon joue très mal son rôle . très décevant !
0	grosse déception . le charme et le talent de mélanie doutey ne parviennent pas à faire décoller cette série . les dialogues sont bâclés , les personnages secondaires pas du tout ou très peu fouillé . fréderic difenthal n'est pas convaincant dans son rôle d'homo . les péripéties sont très prévisibles . on est encore très très loin des séries américaines piquentes et audacieuses . a réserver un soir de pluie .
1	une bonne série avec énormément d'humour , et des acteurs qui jouent leurs rôles à la perfection . un seul bémol , je trouve que les blagues sont souvent prévisibles , ce qui n'améliore pas la crédibilité de l'histoire .
0	cette série complétement invraisemblable , accumule tous les clichés sur la vie en prison ...
1	"mysterious ways est ( enfin malheureusement "" était "" ) une série qui avait du potentiel , une étude réelle sur les éléments mystérieux qui nous entourent . vraiment une série qui aurait eu toutes ses chances si elle n'avait pas été arrêtée . alors avis au créateur ( eh bien évidemment aux acteurs ) continuez , reprenez la série , elle est trop bien !"
0	la réalisation est de qualitée , les acteurs sont pas mals , les dialoguent tiennent la route etc ... mais le scénario c'est du n'importe quoi , il faut en effet beaucoup d'imagination pour conçevoir une telle absurdité . normal , il y tant de séries . on sait plus quoi faire ! ! !
1	c'est une bonne série , le début de la saison 2 est une peu lente et assez ennuyante mais cela s'améliore après quelques episodes . la fin de la saison 2 est encore plus surprenante que celle de la saison 1 . et je n'ai qu'une chose a dire : vivement la saison 3 .
1	c'est une série vraiment bien , c'est une histoire originale , en plus l'acteur principal est très beau .
0	affligeant , autant j'ai aimé dolmen , mais là , c'est pire que tout , une scénario incompréhensible , des acteurs qui ne savent pas jouer . m6 joue la carte des filles à grosses poitrines et des acteurs séduisants , rien de plus ...
0	véronique genest plus stoïque que jamais ( même dans sa pub pour le jambon elle est plus expressive ) et des sidekicks assez pathétiques , cloisonnés pendant des années aux mêmes rôles ! j'aimais bien les deux filles de julie lescaut , dommage qu'elles ne soient pas sorties de là avant , pour se lancer dans le cinéma ...
0	une série dont on parle beaucoup mais qui n'est pas si géniale que ça , beaucoup de parlote et d'histoires d'amour . aucun suspense , une série linéaire .
1	excellente série qui nous montre de manière habille le monde de la justice ... des personnages attachants avec des personnalités et des histoires toutes aussi drôles et tragiques les unes que les autres ... pour ma part , les trois dernières saisons ont été grandioses avec l'affaire du meurtre de varèze , et la disparition tragique de certains membres du cabinet ... hommage à victor garrivier qui a toujours été fabuleux dans cette série !
1	les saisons 1 et 2 sont énormes ! ! ! le réalisateur a une imagination de malade ... des liens de fous auxquels on ne s'attend pas , bref , que du bonheur !
0	sous le soleil à berverly hills . des étudiants parfois décérébrés ... des situations identiques qui se répètent sans cesse ...
1	série de haute qualité . intéressante , intelligente , avec une pointe d'humour . intrigues bien ficelées , bons acteurs en général . je n'avais pourtant pas regardé la première saison mais je me rattrape ! a conseiller parmi les innombrables séries policières diffusées en ce moment .
1	une série qui mêle humour et amour avec des personnages tous attachants , à commencer par son héroïne bien sûr . petit bémol : la dernière saison est assez décevante .
0	on touche le fond avec cette serie , tout les classiques du genre on étaient utilisés . bref , du deja vu et revu avec smallville et surtout des personnages et une mise en scene qui nous font fortement penser à lost . une histoire juste mauvaise , le talent de jj abrams n'etant pas egalé ...
0	avec le recul il faut reconnaître que la série a bien mal vieillie et qu'elle souffre d'une immense répétitivité et d'une certaine lourdeur . cependant certains gags , ainsi que les expressions faciales des héros , font encore hurler de rire .
1	"série à voir et à revoir ! l'histoire des personnages est captivante bien que les cas médicaux choisi par les scéniaristes sont un peu "" tirés par les cheveux "" ! ! !"
0	série minable ! ! elle ne vaut vraiment rien ( diffusée sur tf1 evidemment ! ) les acteurs devraient retourner au conservatoire , les morts pleuvent et il n'y a aucun suspense ni mystère ! a oublier fissa
1	quel univers impitoyable que dallas , ici c'est la loi du plus fort , et le plus fort , c'est le charismatique bobby ewing ! personnage destructeur dans la série , qui n'hésite pas pour le pétrole à utiliser tout les moyens possible . serie culte .
1	serie super sympa ! de la bombe !
1	une série magnifique , qui dure 10 saisons , dans lesquelles on se marre tellement avec tous ces acteurs auxquels on s'attache ! une des meilleures séries comique sans doute .
1	prison break est vraiment une série qui me scotche à mon canapé , très prenante ... on est toujours dans l'attente du prochain épisode , on n'en a jamais assez ! un seul mot : bravo !
0	si vous voulez du ligth cette série est pour vous pour ceux qui aime l'orignal a évité si vous ne voulez pas faire un surdosage de sucre . les personnages sont grossier et une personnalité surjoué . cela ne vaut pas l'original . dommage
0	cette série est vraiment nulle ! il se passe toujours la même chose ! un tel qui meurt , un tel qui se sauve ! je ne sais pas si je ne comprends rien mais , pour moi , cette série est vraiment nulle .
1	un très bon aperçu des pénitenciers à l'américaine ! ce scofield est un véritable cerveau . on y trouve de l'action à souhait , des retournements de situations et cela fait de cette série un moment de montée d'adrénaline à chaque épisode . cela dit , je trouve que c'est parfois trop facile et le coté macgyver m'énerve un peu . mais le genre est nouveau et il faut l'apprécier !
0	je ne regarde plus cette série . je ne supporte pas l'autre gourde d'efira .
1	quelle série ! franchement elle est tout simplement extraordinaire , le scénario est assez original , les personnages sont tous vraiment travaillés , avec leur personnalité ( le jeu des acteurs est d'ailleurs superbe ) . on en redemande et on reste , pendant tous les épisodes , scotché à l'écran ! humour , suspense , enquête , politique , amour , tout est réuni dans cette série pour notre plus grand bonheur .
0	"je trouve cette série ininterressante . a chaque fois que je tente de la regarder , je m'ennuie à un point ... le jeu est mauvais et , pour comprendre l'histoire , il faut avoir regardé depuis le début . un "" des jours et des vies "" à la sauce allemande ."
0	alors c'est sa la série cultissime ! ! ! pfff laissez moi rire ! après le pilote j'ai complètement zappé ... patéthique .
1	pour ma part j'adore prison break . je touve que cette série révèle beaucoup de haine , d'émotion , de courage et de suspense . et je pense que c'est tout cela qui attire les gens .
0	cette série est légèrement divertissante , sans plus . je ne comprends pas pourquoi on en parle autant .
1	une série super ! de la psychologie sur fond de fantastique et c'est avec un grand plaisir que l'on retrouve notre hobbit préféré ( dominic alias charlie ) ! pas étonnant qu'aux usa , cette série crève le plafond ! ! !
1	cette série a définitivement remplacé sex and the city dans ma télé , j'ai vraiment hate de voir la saison 2
1	que dire d'autre à part que c'est une des meilleures séries qui existe . tout simplement genial . on rit à chaque épisode mais on pleure aussi et on en redemande . on a l'impression de vivre leurs histoires avec eux . mention pour les 6 acteurs qui sont fabuleux et qui nous font rire à chaque réplique ! ! ! friends restera une de mes séries favorites !
0	rien de bien nouveau , faut pas esperer se changer les idées avec ça . regardable 5 minutes avant de s'endormir .
0	j'ai trouvé cette série ennuyeuse , les actions se répètent et se répètent , ça devient incohérent ... la série n'est vraiment pas réaliste ( ils arrivent à être toujours aussi bien coiffés et bien habillés ! ) . dommage ...
0	la saison 1 était très bien . mais vu le succès ils ont voulus continuer , résultat une saison 2 nulle , et une saison 3 encore pire . pourquoi ne pas avoir fait une mini-série d'évasion en une saison ( sans rajouter cette histoire de méga-complot bidon ) , cela aurait été parfait .
1	j'adore cette série très originale ; elle est drôle , émouvante , avec de supers acteurs . il y a tous les ingrédients pour que cette série soit réussie . bravo
1	les experts pour moi c'est comme de la drogue , je peux pas m'endormir le soire sans voire une autopsy :)
1	prison break est a mes yeux la meilleure série . scénario bien ficelé , du suspens à vous en donner mal au ventre , un intrigue palpitante , de l'action , de la romance et beaucoup de rebondissements . de plus les acteurs ne sont franchement pas désagréable a regarder . alors si vous ne connaissez pas , n'hésitez plus =) : a regarder d'urgence ! ! !
1	impressionant tant cette série est captivante.lost c'est l'art de faire monter l'adrénaline d'un coup.de plus les acteurs sont vraiments bons.parfois on rigole aussi.bref une série incroyable qui tient en haleine !
