1	probablement le meilleur pilote jamais réalisé pour une série télé . diablement addictif et interpété de manière inspiré , lost est une série à ne pas manquer .
0	série inintéressante banale le scénario est décevant et on ne rentre pas du tout dans la série .
1	c'est la première série que j'ai regardée quand j'étais plus jeune . je l'ai vraiment adorée , elle était géniale .
0	malgré les originaux rebondissements , la série reste ennuyeuse à mourir . a éviter absolument !
1	jamais je n'aurais cru mettre 3 etoiles a une serie française , sutout une serie policiere , mais il faut avouer que celle ci est tres plaisante , malgré encore de gros defauts , et un nom vraiment à chier ! allez , vous pouvez faire mieux , plus de rythme , encore plus de punch , et de l'action nom d'une pipe !
0	cette série est vraiment vide , aucune intrigue réelle , un scénariot ultra plat , et des acteurs vraiment nuls , on n'y croit pas un seconde , je ne pense pas qu'elle fera long feu ... passez vote chemin .
1	très sympathique .
0	"je me retrouve dans ma cuisine à boire ma tasse de thé , j'allume la télévision , me disant que ça me fera passer le temps , et je finis par décamper deux minutes plus tard tellement c'est exaspérant . la télévision est vraiment nulle , "" le destin de lisa "" ose faire pire ."
0	moi je dis zero ! ! ! c'est une véritable copie de grey's anatomy ! le réalisateur n'a aucun mérite !
0	j'attendait cette serie avec grande impatience , j'ai regardé le premier épisode que j'avais plutot apprécié , et puis dés le deuxième j'ai décroché . c'est devenu ennuyeux , trop de paroles , cela ne bouge pas , cette serie est vraiment un echec , minable et sans interêt .
0	pâle copie des experts , ris ne trouve pas son style , les scénarios ont bien souvent été exploités avant . les acteurs n'ont pas l'air d'être dans leurs personnages . la musique est sympa mais a un air de déjà entendue . un peu décevant au vu de l'abattage médiatique effectué par tf1 lors de son lancement . mieux vaut rester sur la sèrie originale .
0	""" louis la brocante "" , rien que le nom , tu sens que tu vas t'endormir au bout d'un quart d'heure , j'ai regardé un épisode ( et pourtant j'ai 13 ans , pas 80 ) , je me suis endormi . c'est une petite série minable , aux histoires ennuyeuses et sans aucun intérêt , les acteurs jouent mal , les gags sont minables ..."
0	une bonne première saison , puis après j'ai lâché . tout ce qui faisait le charme originel du film tombe petit à petit en miette , et laisse une série ultra populaire , on ne sait plus pourquoi , qui ne cesse de s'embourber dans des scénarios aussi pathétiques les uns les autres . vraiment dommage ...
0	série sans intérêt qui n'est que le remake de plusieurs films traitant du même sujet . pourquoi m6 s'obstine t-elle à nous diffuser des séries dont la production a été arrêtée ?
1	cette série est un pur bonheur et raviera tous les amateurs de mangas mélant graphisme superbe , scène d'action choc et une bande son a tomber par terre . dans la lignée des samurai champloo c'est tout dire : cette série est vraiment super
0	encore de la daube production , suite de la suite de la daube . ils ramassent encore de l'audimat en plus ! ! mais moi , je ne peux pas mettre 0 avec virginie desarnauts désolé .
0	que peut t'on dire de cette série : alors , c'est plat , c'est nul c'est mal joué , c'est horrible , c'est pitoyable , c'est indescriptible , c'est un suplice de regarder ça ! 1 épisode m'a suffit pour me dégouter de cette série .
0	je n'aime pas cette série car elle est basé sur des gags nuls . de plus , les personnages sont vraiments débiles . je la déconseille franchement !
1	qu'est que je kiffai cette série quand j'étais petit . bon aujourd'hui ca à du très mal vieillir , et c'est vrai que les scénarios sont d'une finesse et nouveauté très regrettable quand aux actrerus pfiouuu ... mais je met une si bonne note en me rappelant ma jeunesse , quand je sortai de l'école en vitesse pour pas rater cette série .
1	je n'ai vu que le premier épisode , mais ça promet grave ! et puis wentworth miller est tout simplement magnifique ! l'histoire est vraiment très originale et je sens que je vais me prendre de passion pour cette nouvelle série !
1	j'adore coeur océan , ça parle de vraies histoires d'amour comme dans la vraie vie où il y a disputes , amour , trahisons , conflits , amitiés et surtout beaux gosses . c'est vraiment la série que je préfère . je mets évidemment le maximum d'étoiles car c'est une super série .
1	univers variés , personnages nombreux , bo magnifique , animation originale , déconnades , émotion au rendez-vous , histoire vraiment sympa avec de nombreux fils rouges ... op est un des meilleurs mangas actuels tout simplement ! ! !
0	"je prefere encore regarder "" josephine ange gardien "" ... c'est dire ! ! !"
0	j'ai adoré l'idée , l'histoire qu'elle a voulu conter ... seulement , du fait qu'elle ait été arrêtée si tôt , le tout est vite parti de travers , ne laissant qu'une des 4 étoiles que je voulais lui mettre ... dommage ...
0	concept intéressant et original d'où une première et deuxième saison passionnantes . le problème c'est que la suite se ressemble et du coup , on s'en lasse , on en devient écoeuré , jusqu'à ne plus regarder ...
0	comment regarder ça jusqu'à la fin ? 5 minutes m'ont suffi pour être dégoûté ... si les acteurs jouaient mieux j'aurais peut-être poussé jusqu'à 10 ... vivement que les scénaristes américains se remettent au boulot !
1	j'adore trop cette série elle est pleine d'humour et très triste parfois ...
1	avec toujours plus de suspense , un jack bauer toujours plus fort et habile , une trame sans cesse accrocheuse , 24 heures chrono réussit à chaque nouvelle saison à nous faire suivre cette satané journée d'enfer sans relâche . juste une note négative sur l'image de l'agent américain combattant des terroristes venus de l'est . un cliché qui au fur et à mesure s'essouffle et peut sembler ambigü à force ...
1	cette série est vraiment très très bien . un humour noir comme je l'aime qui nous fait hurler de rire . les actrices sont excellentes , l'intrigue est au rendez-vous ! bref on passe un super moment de détente après une longue journée .
1	quand j'avais 8 ans et qu'on me demandait ce que je voulais faire quand je serai grand , il était evident que peu importe mon métier , j'aurai une moustache , une ferrari rouge et une chemise hawaïenne ... le plus dramatique c'est que ma chemise hawaïenne fait tache dans ma vieille renault 9 ...
1	1 série américaine qui est pour moi et de loin la meilleure que je connaisse . lorsqu'on m'a dit de quoi cette série traitait je n'étais pas tres emballé mais dès la fin du 1er épisode , je le savais : j'étais accro ! ! ! et au fil des épisodes cela m'a paru de + en + intéressant ! ! ! ne ratez surtout pas cette série tout au long de l'été sur tf1 ! ! !
1	cette série est tout simplement géniale ! brett sinclair et danny wilde sont des personnages super attachants , avec leurs caractères propres , leurs manies .. le générique est mythique , cette série est pleine d'humour et n'a pas pris une ride . dommage qu'il y ait eu si peu d'épisodes ! !
1	j'adore cette série , elle me fait penser un peu à urgences mais en mieux avec des histoire de coeur et une bonne dose d'humour . je trouve dommage qu'elle passe si tard ! mais je la trouve super ...
0	trop de ressemblance avec ' un , dos , tres ' . l'histoire n'est pas très bien recherchée . je pensais que ça serait mieux que cela .
0	j'adore cette série , elle est tellement bien . je la trouve très réelle et pleine d'émotion vis à vis des deux frères .
1	une série qui se bonifie en avançant dans la saison . des personnages paumés , de bons gros loosers à la masse mais qui provoquent des fous rires incessants . génial et toujours guidé par le karma .
1	j'ai pas tout de suite accroché a la série , mais au fil des épisodes je dois l'avouer , je me suis mise a adorer les personnages et l'intrigue . une série géniale . et bien sur mention spéciale pour milo ventimiglia ...
0	cherche le politiquement correct . dialogue aussi interresant qu'une tombe . scenario plongé dans la bouse . en gros c'est nul .
1	je trouve que cette serie est captivante . elle nous tien toujours en haleine et les intrigues sont nombreuses et interessente . les acteurs font du bon boulot
1	notre belle famille , une série à ne pas rater ! depuis ma plus petite enfance j'ai vu et revu les différentes saisons de ce chef-d'oeuvre . des épisodes alliant tous le comique et la vie réelle d'une famille recomposée , faisant apparaître de nouveaux sujets à chaque épisode . jamais je ne me lasse de ces rediffusions répétées , une série comme on n'en fait plus !
1	excellente série policière .
0	je ne comprends pas et ne comprendrai jamais le succès de cette série niaise à souhait et qui bénéficie d'une moral à toute épreuve . oui , je le confirme , on peut tout de même l'apprécier si on est sourd et aveugle .
1	trop géniale cette série . il y a toujours pleins de rebondissements et kiefer sutherland est trop bien dans le rôle de jack .
0	je ne suis pas du genre à faire des mauvaises critiques , mais cette série est la caricature de la famille parfaite . en réalité , elle ressemble plus à celle de bree van de kamp qu'à l'american dream .
0	franchement au debut j'ai pas regarder , probleme d'horaire et en plus c'est une serie pour la menagere par excellence . mais aprés j'ai regardé et j'ai bien aimé . c'est drole et dramatique a la fois , des personnage attachants et des situations en vois tu en voila tout ça souspoudré d'une intrigue trés bien ficelée donc chapeau ...
1	tout simplement je trouve cette série génial
1	bon , c'est une série assez bien , les acteurs ne sont pas mauvais , le scénario est plein de rebondissements . dommage que l'aspect fantastique soit mis un peu de côté .
1	cette série reproduit chaque épreuve que traverse une femme au foyer . s'occuper des enfants , faire les courses , le ménage . je pense que sans les séries télé américaines , on ne verrait pas grand chose . par exemple les feux de l'amour , grey's anatomy ... ceci est indispensable en france .
1	cette série montre la réalité d'un quartier français avec ses hauts et ses bas . les intrigues sont souvent réalistes ( grossesse involontaire , homosexualité , infidélité ... ) je ne regrette pas du tout d'avoir découvert cette série ...
0	une série que je regardais avec plaisir avant , mais qui a fini par me dégoûter ... l'atmosphère est quelque peu manichéenne et uniforme dans les intrigues , véronique genest a l'air de s'y ennuyer ferme , en plus ... une étoile tout de même parce qu'elle joue bien , ainsi que les autres acteurs que j'aime bien , de surcroît ...
0	je trouve cette série totalement inintéressante . tout le monde disait que c'était la série de l'année . il ne se passe rien , après une saison on n'a pas du tout avancé c'est aussi lent qu'un soap opéra , le suspence c'est le même . la seule chose que j'ai à dire c'est que les descendant de jules verne devrait demander des droits d'auteurs : on dirait l'île mystérieuse . on peut vraiment s'en passer !
0	cette serie semblait prometteuse dans ses premiers episodes et puis on bascule rapidement vers le conformisme , le politiquement correct ... au final on obtient une serie banale avec une fin prévisible et convenue . décevant .
0	le seul avantage de cette série c'est qu'il suffit de regarder un épisode par an pour suivre l'intrigue ( si jamais elle existe ) .
0	horrible ! rien a redire a par bon samaritain et fanatiques religieux bienvenue ! ^ ^
1	action , frissons , rebondissements , une première saison pratiquement parfaite . la vraie bonne surprise de la rentrée 2004 us ( enfin avec desperate housewives ) . a voir absolument cet été sur tf1 !
0	quand le voisin fox essaie de copier sur son voisin abc , voilà le piètre résultat que ça donne ... quintuplés n'est qu'une copie des sauvages , et une copie bâclée en plus ...
0	c'est simple , dans cette série débile , même les hommes pensent comme des femmes , et encore pas n'importe quelle femme , la femme qui lit voici , qui a elle comme bible et l'anorexie pour mode de vie . franchement je serais pour condamner à la prison à vie les gens qui ont creer cette bouse créatrice de metrosexuels attardés .
1	génial ! entre corruption et tensions , la série choc de canal + est l'une des meilleurs séries françaises du moment . ca nous change des bétises de tf1 , avec engrenage , canal nous offre le duo gagnant , continuez ! !
0	beaucoup de mièvreries et d'invraisemblances dans cette saga qui regroupe hélas toutes les recettes des sagas de l'été avec ses histoires de familles toujours identiques et des rebondissements qui nous font autant d'effet qu'un somnifère . souvent risible par sa nullité exceptionnelle , cette série n'est pas sauvée par ses acteurs , très mauvais ( claire borotra ) ni par sa fin affligeante .
0	autant la 1ere saison était superbe ... je n'ai pas suivi la suite . les saison suivante suont un massacre . dommage .
1	c'est frais ! ca change ! léger même quand c'est grave . série qui met le sourire et ça fait du bien . elles sont rigolotes ces bonnes femmes quand même ! a noter un petit relâchement dans le scénario de la saison 2 parfois limite et qui traîne en longueur ... mais bon , ça reste quand même une très bonne série dont il ne faut pas se priver , ce serait dommage .
0	une énième série française pour ado , sans profondeur , sans originalité , sans acteurs , sans daigner susciter un intérêt , sans éviter les traditionnels sujets que les séries pour pubères nécessitent . je ne doute pas que la 5eb idolâtre cette série que moi , vieux briscard , utilise afin d'obtenir quelques fous rires matinaux devant un spectacle aussi consternant .
0	heroes est , comme lost , les 4400 et prison break , une mauvaise série . mal réalisée , mal scénarisée , avec idée de départ peu originale et mal exploitée , il n'est pas étonnant qu'elle rencontre un tel succès outre atlantique . tf1 l'a acheté , ce n'est même pas une surprise . evitez là !
1	""" angel "" est bien plus qu'un simple spin-off , c'est une série à part entière bien loin de l'univers de "" buffy "" . la série a su s'imposer grâce à des scénarii originaux , une atmosphère plus sombre , des personnages attachants ( notamment l'évolution du personnage de cordelia et de ses rapports avec angel ) ... bien que j'apprécie la série "" buffy "" , je lui préfère largement "" angel "" ."
0	34ans non mais rendez vous compte ca vaut une etoile car pour faire une telle daube avec un scenario insipide qui dure depuis 34ans y merite bien une etoile et mon coup de chapeau . j'ai entendu qu'elle va s'arrete dans 3 ou 4 ans.thanks god .
0	mais qu'est ce que c'est que cette série . ca ressemble trop à rien . même walker texas ranger présente un intéret supérieur . c'est dire . même pas de jolie pépé pour se rincer l'oeil .
1	je mets 4 étoiles et c'est encore insuffisant ! cette série est tout simplement géniale , elle est pleine de classe , hyper drôle , et chaque épisode est super . il y a une morale à chaque épisode et ça c'est cool ! en plus les actrices sont formidables , elles ont toutes un excellent jeu .
1	cette série mérite largement ses 4 étoiles elle redynamise le monde des soaps et les acteurs jouent plutôt bien surtout adam brody . amour , trahison , et beaucoup d'argent c'est la vie des jeunes de newport dans la série . mais surtout les adultes ont autant voir plus d'embrouilles que les enfants . bref tout pousse à regarder cette série .
1	c'est une série vraiment géniale ... vivement la saison 3 sur canal + ... regarder là , ça vaut le coup d'oeil ...
1	j'ai découvert récemment cette série sur jimmy , j'ai beaucoup aimé , c'est vraiment drôle , c'est vraiment dommage que cette série na'ai eu que 2 saisons .
0	ben j'aime pas , c'est tout , je trouve ça nunuche , les dialogues cucul , les histoires entre les membres sont pauvres et le personnage principal n'est pas essentiel . je prefère largement dr house .
0	de pire en pire , avant j'adorais maintenant c'est devenu n'importe quoi ! les personnages sont moins intéressants ! des retournements de situation que l'on ne voudrait pas voir , grande déception , 24h chrono est largement plus passionnante !
1	bravo l'une des séries américaines qui pour moi mériterai un oscar même quentin tarantino c'est amusé avec cette bande de flic qu'on adore voir et revoir , parce que les acteurs sont bons et les enquêtes très bien menées par les producteurs , scénaristes et toutes les autres personnes qui participent à la réalisation des épisodes .
0	je trouve cette série totalement inintéressante . tout le monde disait que c'était la série de l'année . il ne se passe rien , après une saison on n'a pas du tout avancé c'est aussi lent qu'un soap opéra , le suspence c'est le même . la seule chose que j'ai à dire c'est que les descendant de jules verne devrait demander des droits d'auteurs : on dirait l'île mystérieuse . on peut vraiment s'en passer !
1	j ' adore cette série je la regarde tous les jours
0	au début j'y ai cru , mais assez rapidement je me suis rendu compte que prison break était une fausse bonne série . très édulcorée , mal interprétée et sans suspens , sans émotion , sans rien , superficielle , artificielle . du vide .
0	je trouve que cette série est moins bien faite que les autres new york , de plus , trop de meurtres / viols , etc ... a force c'est un peu répétif et glauque . le tout parfois complété de dialogues choquants , forts , voir trop francs . toutefois , je comprends que beaucoup de monde aime car c'est vrai que les enquêtes sont bien faites , et les fans du genre apprécieront .
0	une très mauvaise série , tant sur le plan du jeu des acteurs totalement inexistant que sur le fond ... en fait il n'y a pas de fond ... au final : certainement ce qui se fait de moins bon à notre époque , en matière de série . si seulement ça pouvait être un tout petit peu palpitant , mais non , c'est le vide total . ca devrait s'éviter d'instinct .
0	ouff cette série est bien loin d'etre drole ... raven est une egoiste qui se met toujours dans la merde mais grace a ses supers amis et sa genialisime famille tout le monde lui pardonne en plus elle est perturbé avec ses visions la pauvre ro ! en plus les episodes sont tous rengaine ( jsais pas commen ça s'ecrit lol ) et c'est vraiment pas une série qui vaut la peine d'etre vu ...
0	je vien tout juste de regarder les 4 épisodes et ben .. c'est pourit ! humour télé-achat comme ceux des inconnus mais en moins drôle et plus pourit ! oh moint les inconnus avait de l'idée ! en plus les blagues sont gros comme des maisons ! vraiment pas bon ! - boujour michel ? - envoir michel ! - convaincu ? - ben .. non !
0	nulle ! la pire série française ( il fallait le faire ) ! les acteurs sont pathétiques , cette série nous narre l'histoire d'adolescents qui ont des problèmes avec leur vie sexuelle , c'est toujours la même chose ! ils pourraient nous mettre un peu d'humour , au lieu de ça c'est 20 à 30 minutes bourrées de sentiments destinés à émouvoir le public ! a ne pas voir !
0	pfff tros nul ! ! ! j'ai pas tros suivies mais le peu que j'ai regarder est nazze sa part dans tout les sens c'est plat nient nient les acteures sont nul ! ! ! mais vraiment je trouve cette séries inutile ! ! !
0	"cette série devrait être diffusée le dimanche matin pendant le "" jour du seigneur "" . pas une seule réplique où on ne nous parle pas de dieu ... de plus , cette famille est très certainement pour la peine de mort et contre l'avortement ... ils font ce qu'ils veulent mais j'aimerais bien que ce ne soit pas dans mon téléviseur ."
1	une series de super heros avec de très bon effets speciaux merite 4 étoiles . j'adore cette série qui passe sur tf1.elle fini 2ème dans mes series préférés . bravo en tout les cas au realisateur tim kring .
0	ben sincèrement ! j'ai jamais pu regarder un épisode en entier ! trop approximative à mon goût ! cette série semblait réalisée par un bande de pôtes sans moyens , sans convictions et malheureusement sans acteurs ... a éviter !
1	je ne connais pas la prmeiere serie mais il faut avouer que celle ci est superbe de la pure sf comme je l'aime
0	lamentable si seulement il la supprimer du cable ( sur tmc ) mais nuit d'insomnies serait plus agreables passe des vielles series americaines des annes 80 si c'est une question d'argent ca doit pas valoir bien cher non plus
0	série policière américaine aux acteurs navrants et à la propagande idéologique au ras des paquerettes . je supportai difficilement les 2 épisodes à la suite ...
1	la meilleure série que je n'ai jamais vue ! ! c tellement inventif merveilleux , c monumental ! ! rien d'autre a dire ! ! ! on en redemande encore et encore ! !
1	l'ensemble du casting ( vraiment excellent ) , les dialogues , un scénario original ( l'histoire abordant les thèmes de la maladie , de l'homosexualité lors des mandats de reagan et bush , c'était osé ) : tout ça fait d'angels in america une télésuite prenante , tout à fait atypique , qui apporte une véritable réflexion .
1	excellente série très originale mais qui peut finir par lasser légèrement par le jeu de ses actrices ou de ses énigmes légères . mais rien de grave face à ce dépaysement constant de fraîcheur et d'intrigue .
1	certes c'est une adaptation d'une série américaine ! mais il faut être honnête , c'est une excellente adaptation ! les acteurs sont très bien choisit , vincent perez est excellent , dans ce rôle ! les enquêtes ne sont pas nouvelles , mais très bien adaptées en france ! mention spécial à la salle d'interrogatoire reproduite à l'identique :)
1	c'est trop amusant et il y a beaucoup de mystères à découvrir dans chaque épisode . c'est ma série préférée et à chaque fois qu'elle commence je saute dans mon salon !
1	avec un casting de rêve ( tous les personnages principaux sont très convaincants ) on arrive à une série qui fait réfléchir , et qui n'est pas non plus choquante . explorer les liens que sont les relations d'amitié , d'intimité et d'amour entre ses différentes femmes est absolument magnifique . on se retrouve confronté à des sentiments originaux et pourtant tout autant touchants . bref un must , de la qualité comme en fait hbo .
0	moi aussi je viens de voir un extrait et sa a l  air vraiment nul et c  est aussi incomparable avec la version américaine . les acteurs sont bof et me font penser au acteur policier de toute les série policière niaise de 90 min sur tf1 . voila quoi tf1 prend une des meilleures séries américaine et en fait un navet . merci tf1 .
0	"j'ai patienter jusqu'au quatrième épisode , c'est laborieux , finalement j'ai vraiment l'impression de regarder une serie style "" cherie j'ai rétrécie les gosses "" . ayant adorer the lost room produit également par sci fi je m'attendait à beaucoup mieux ! passer votre chemin ."
0	tout comme helene et les garcons , un merveilleux concept de nullité totale ( charactérisation des persos , décors , dialogues , musiques , réal ' , scénar ' ... tout est à jeter ) qui en deviendrait presque culte chez les déviants dans mon genre ( seulemnt les jours ou j'ai 3 grammes dans le sang , faut pas poussser non plus ) .
1	cette série est génialissime ! il y a du suspense , de l'action , de l'humour , de l'amour ... tout ce qui est nécessaire pour une bonne série , elle est tellement bien qu'il suffit d'un seul épisode pour être drogué ! vivement la saison 2 !
1	la sitcom la plus drôle que j'ai pu voir de mon existence , pas une seconde sans exploser de rire ! c'est à ne surtout pas manquer !
1	cette série est géniale . je suis aixois et je reconnais tous les paysages de marseille sauf la place du mistral qui est imaginaire . tout est fait pour tenir en haleine et la plupart des personnages sont réalistes . cependant , j'enlève 1 étoile pour les acteurs qui incarnent bien leurs personnages mais récitent leur texte . mais bon , je suis accro .
0	déçu par cette série que la critique définissait comme hilarante , c'est un humour très lourd , je la trouve révolutionnaire dans la débilité . l'image est mauvaise , les décors pas terribles , les personnages peu attachants et les histoires n'ont aucun sens .
0	enième série qui vaut que tchi que dalle et je ne suis pas le seul à le penser , heureusement ! porry , faut arreter le massacre !
0	désirez-vous manger un potage fade agrémenté de gros navets ? si oui cette série est pour vous !
1	les fréres scoot c'est mon cousin qui ma fait découvrir cette série je le remercie encore mais commen j'ai pu passer à coter de sa . c'est tellenment excélent il y a trop de rebondissements , de bouleversements et trés délirant emplus de sa .
0	nul de chez nul indigne m6 de diffuser ce genre de série , un vrai navet , quoi regarder le samedi soir maintenant !
1	mouaip , ce n'est pas la série du siècle , mais on est tenu en haleine ... mission réussie pour la prod ! on sent franchement par moment que les scénaristes ne savent pas où ils vont sur cette nouvelle saison , mais c'est amusant de les voir sortir à chaque fois le lapin du chapeau ...
1	une trés bonne série , amusante ! ! ! personnages fantastiques , surtout pour l'oncle eddie ! ! ! 5 saisons , parfait ! ! !
